// Max Jabotinskiy quotes from srach dates
window.MAX_SRACH_QUOTES = [
  {
    "text": "Та він не шарить))",
    "date": "2025-07-08",
    "time": "08.07.2025 07:27:24 UTC+01:00"
  },
  {
    "text": "Це він мої повідомлення в чаті перечитав і його вставило реально!",
    "date": "2025-07-08",
    "time": "08.07.2025 08:12:55 UTC+01:00"
  },
  {
    "text": "Там в нього є більш прикольні ідеї з того що у більшость церков хочуть зробити  однаковий звук малого барабану, а більший крінж що однаковий звук малого бараьану для всіх пісень 😁😆",
    "date": "2025-07-08",
    "time": "08.07.2025 08:17:03 UTC+01:00"
  },
  {
    "text": "\"Удачі. Це просто стіна з каші з моновокальною композицією зверху.Ось так звучить нижча ліга.\"Minor league було залучено у зовсім іншому сенсі і зовсім не у сенсі обʼєму/розміру приміщення!Ось і ще один дорослий у звуці чувак написав таке саме зауваження як і я - то не є справжнє стерео!Але ж у Ч...",
    "date": "2025-07-08",
    "time": "08.07.2025 08:28:19 UTC+01:00"
  },
  {
    "text": "Будь ласка, звичайно ж ти розумієш! І стерео дійсно піддається масштабуванню - \"чим менший зал, тим більший відсоток покриття стерео\", все так і є!А всі ті Боб МкАрті з Мейр Саундом іх дослідження та наукові статті, Лі Філдс чи якись Макс просто нічого не розуміють у звуці та справжньому стерео!",
    "date": "2025-07-08",
    "time": "08.07.2025 08:41:38 UTC+01:00"
  },
  {
    "text": "Не здаватись, він і є викривлений та розмитий )Але ми дійсно не можемо то знати бо в Чернівцях інший вимір реальності та звук працює трохи інакше - стерео  мастабується в залежності від розмірів залу…",
    "date": "2025-07-08",
    "time": "08.07.2025 08:48:24 UTC+01:00"
  },
  {
    "text": "Там у другій частині повідомлення є важливе  зауваження - робити панорамування так щоб воно залишалось однаковим для 99% приміщення…",
    "date": "2025-07-08",
    "time": "08.07.2025 08:52:03 UTC+01:00"
  },
  {
    "text": "Наскільки різні сигнали у стерео гітарі або у стерео міксі?!А яке взагалі буде складання у двох різних сигналів (стерео)?",
    "date": "2025-07-08",
    "time": "08.07.2025 09:06:25 UTC+01:00"
  },
  {
    "text": "Зроби мені вокальну групу або гітари настільки різною щоб вона не віднималась у деструктивній інтерференції та щоб це звучало природно та однаково у більшості залу! 😉",
    "date": "2025-07-08",
    "time": "08.07.2025 09:16:03 UTC+01:00"
  },
  {
    "text": "Такий метод порівняння не відповідає вимогам дослідження!Якщо електронно поєднати два канали (стерео) \"хороших треків\" то деякі нюанси міксу зникнуть, тому при прослуховуванні буде помилково здаватися що \"хороші треки\" звучать краще у стерео ніж у моно.Але для вірності наукового дослідження треба...",
    "date": "2025-07-08",
    "time": "08.07.2025 09:25:08 UTC+01:00"
  },
  {
    "text": "Тому для вірності дослідження \"моно\" та \"стерео\" мікс повинна робити одна людина. У тому і буде порівняння моно/стерео.",
    "date": "2025-07-08",
    "time": "08.07.2025 09:30:59 UTC+01:00"
  },
  {
    "text": "Треба починати з міксу моно, вчитись міксувати у моно…",
    "date": "2025-07-08",
    "time": "08.07.2025 09:45:13 UTC+01:00"
  },
  {
    "text": "Гітара у стерео працює так само як і клавіша у стерео - ліва та права рука розподіляється між правим та лівим каналом стерео?",
    "date": "2025-07-08",
    "time": "08.07.2025 09:47:07 UTC+01:00"
  },
  {
    "text": "Ну якщо взяти різні бас барабани, налаштувати по різному та зробити так щоб на них грали різні барабанщики, зняти їх різними мікрофонами та розвести їх по різних каналах, то так - природа сигналів двох бас барабані буде різна та інтерференції майже не буде.",
    "date": "2025-07-08",
    "time": "08.07.2025 09:58:26 UTC+01:00"
  },
  {
    "text": "Але зробити низькі чи будь які частоти іншими в різних каналах з одного каналу/інструменту щоб вони залишились природні та не спотворенні по звучанню - інтерференції буде так само! Може десь і буде лише трішечки менше, але то прям не значно що зневажати інтерференцію та робити на цьому значний ак...",
    "date": "2025-07-08",
    "time": "08.07.2025 10:07:28 UTC+01:00"
  },
  {
    "text": "Ну тоді склади мені два рожевих шума з різних генераторів, та подивимось чи буде взагалі інтерференція між ними, на скільки дБ вони максимально поєднаються та на скільки дБ вони віднімаються! Тоді і поговоримо складаються вони чи не складаються, яка в них інтерференція або про частоти на та на ск...",
    "date": "2025-07-08",
    "time": "08.07.2025 10:24:31 UTC+01:00"
  },
  {
    "text": "Ну то тепер зрозуміло, що ти взагалі не розумієшся на поєднані сигналів та базових речах у звуці.Я навіть продовжувати не хочу, ти просто вимахуєшся та хочеш бути правим та важливим там де ти не розумієш базових речей.",
    "date": "2025-07-08",
    "time": "08.07.2025 10:33:13 UTC+01:00"
  },
  {
    "text": "Яке може бути взагалі поєднання двох не когерентних сигналів таких як дабл трек електрогітар?",
    "date": "2025-07-08",
    "time": "08.07.2025 10:35:07 UTC+01:00"
  },
  {
    "text": "Ну ти залив вуглі бензином))",
    "date": "2025-07-08",
    "time": "08.07.2025 10:35:26 UTC+01:00"
  },
  {
    "text": "Як взагалі це може може аргументом чи апеляцію на питання де чітко вказано що один канал та один інструмент?!Який ще дабл трек гітар? Чого ти крутишся як той чорт на сковороді - я вже декілька разів навів приклад але ти не відповідаєш та наводиш взагалі інші приклади де сигнали загалом різні прир...",
    "date": "2025-07-08",
    "time": "08.07.2025 10:42:09 UTC+01:00"
  },
  {
    "text": "Саме це і визначає що ти не розумієшся на базових речах у звуці та акустиці. Тому всі мої апеляції та спроби мати діалог -",
    "date": "2025-07-08",
    "time": "08.07.2025 10:43:41 UTC+01:00"
  },
  {
    "text": "Я зробив - запустив трек! Занавіс!",
    "date": "2025-07-08",
    "time": "08.07.2025 10:48:37 UTC+01:00"
  },
  {
    "text": "Ми говоримо за живий виступ, та мікс \"живих\" музикантів у залі!Але аргумент і є блискучим тому що у твоєму прикладі поєднується два різних по природі сигнали - дабл трек гітар! Що насправді і показує твоє знання у базових речах, бо коли ми говоримо за інтерференцію та поєднання -  поєднуватись мо...",
    "date": "2025-07-08",
    "time": "08.07.2025 10:56:57 UTC+01:00"
  },
  {
    "text": "Ти не правий, ефект інтерференції присутній і не зменшується значно!",
    "date": "2025-07-08",
    "time": "08.07.2025 10:58:48 UTC+01:00"
  },
  {
    "text": "Зупинись! Не вже тобі так важливо викрутитися та хоч десь бути правим і залишитись якимось значимим фахівцем у чаті?Будь ласка, не треба!Ти ж як той президент Трамп - своїм новим повідомленням  суперечиш своєму попередньому повідомленню!",
    "date": "2025-07-08",
    "time": "08.07.2025 11:06:16 UTC+01:00"
  },
  {
    "text": "Ну давай це перевіримо на останніх повідомленнях -",
    "date": "2025-07-08",
    "time": "08.07.2025 11:11:51 UTC+01:00"
  },
  {
    "text": "Вже не важливо",
    "date": "2025-07-08",
    "time": "08.07.2025 11:20:08 UTC+01:00"
  },
  {
    "text": "Як краще міксувати низьки частоти, бас і саби…",
    "date": "2025-07-08",
    "time": "08.07.2025 11:26:10 UTC+01:00"
  },
  {
    "text": "Це тому що тобі більше нема чого сказати по темі?",
    "date": "2025-07-08",
    "time": "08.07.2025 11:28:29 UTC+01:00"
  },
  {
    "text": "Не буде сприйматись однаково і природньо по всьому залу в стерео - це відверта брехня! 🤥",
    "date": "2025-07-08",
    "time": "08.07.2025 11:36:57 UTC+01:00"
  },
  {
    "text": "Коли треба викрутитися то вже як є 😁Ти вірно підкреслив, в тому і річ - хто слідкує той зрозуміє!",
    "date": "2025-07-08",
    "time": "08.07.2025 11:39:11 UTC+01:00"
  },
  {
    "text": "Це взагалі не смішно саме для мене, бо саме Антон мені поперше друг по друге брат та служитель. А не просто відома мені людина з ютуба чи конференцій з якої можна глузувати.То не зрозуміло яка дружба тобі важливіша!",
    "date": "2025-07-08",
    "time": "08.07.2025 11:45:51 UTC+01:00"
  },
  {
    "text": "О то і я не знаю про яку таку дружбу ти розповідаєш і що тобі важливіше!",
    "date": "2025-07-08",
    "time": "08.07.2025 11:47:47 UTC+01:00"
  },
  {
    "text": "Та ні! Там чітко написано - \"менідружба важливіша…\"",
    "date": "2025-07-08",
    "time": "08.07.2025 11:51:29 UTC+01:00"
  },
  {
    "text": "Я ж і написав що контекст для тебе не важливий, для тебе важлива правильна відповідь на твій розсуд!",
    "date": "2025-07-08",
    "time": "08.07.2025 12:02:11 UTC+01:00"
  },
  {
    "text": "Яке це має відношення до обговорення моно/стерео та твоїх відповідей без утримання у контексті, крім того що ти хочеш перевести фокус на мене чи попередні відносини? Щоб що?",
    "date": "2025-07-08",
    "time": "08.07.2025 12:10:16 UTC+01:00"
  },
  {
    "text": "Це є мій висновок з дискусії, бо ти так і не зміг відповісти на питання або підтримати дискусію не відволікаючись від контексту обговорення.Факти є фактами - Коаксіали грають на 10 метрів, ще ніхто так не вимахувався на мою памʼять!",
    "date": "2025-07-08",
    "time": "08.07.2025 12:35:14 UTC+01:00"
  },
  {
    "text": "Твої відповіді у скрінах не у контексті дискусії.Про це@dima_opalkoнавіть написав тобі!",
    "date": "2025-07-08",
    "time": "08.07.2025 12:37:09 UTC+01:00"
  },
  {
    "text": "Я тут не до чого, інші теж це помітили і навіть Діма написав тобі про ц!",
    "date": "2025-07-08",
    "time": "08.07.2025 12:39:53 UTC+01:00"
  },
  {
    "text": "А де у моєму повідомлені, яке ти цитуєш у скріншоті, написано про групу гітар?!",
    "date": "2025-07-08",
    "time": "08.07.2025 12:43:23 UTC+01:00"
  },
  {
    "text": "Завтра послухаю",
    "date": "2025-07-08",
    "time": "08.07.2025 13:07:22 UTC+01:00"
  },
  {
    "text": "Послухав - у позитивній полярності більше низьких частот ніж коли один з капсулів у негативній полярності…",
    "date": "2025-07-08",
    "time": "08.07.2025 22:41:18 UTC+01:00"
  },
  {
    "text": "Залежить від того чи потрібні тобі низьки частоти або кранч на високих.Я трохи покрутив і згадав чому цей мікро мені не зайшов - дуже багато різних варіантів та потрібна окрема група щоб робити загальну еквалізацію для двох капсулів - що у лайві не дуже ефективно та витрачає ресурс консолі.Ідея п...",
    "date": "2025-07-08",
    "time": "08.07.2025 23:42:05 UTC+01:00"
  },
  {
    "text": "А як \"правильна розсадка\" взагалі впливає на твій стерео чи моно мікс у концертному залі ?",
    "date": "2025-07-19",
    "time": "19.07.2025 00:14:21 UTC+01:00"
  },
  {
    "text": "Вибач але де стверджується що це зал на 1000 людей? 😂 Не треба вигадувати, цього точно нема! Саме у допису йде мова про кількість приблизно у 10 людей.",
    "date": "2025-07-19",
    "time": "19.07.2025 01:28:17 UTC+01:00"
  },
  {
    "text": "Доречі я вже наводив цей трохи перебільшений приклад від лягущатників! Але так, вони теж нічого тямлять у звуці!",
    "date": "2025-07-19",
    "time": "19.07.2025 01:36:12 UTC+01:00"
  },
  {
    "text": "А хто саме рахує?!",
    "date": "2025-07-19",
    "time": "19.07.2025 01:42:26 UTC+01:00"
  },
  {
    "text": "Та ти теж не святий, загинаєш ліпше ніж Арестович!",
    "date": "2025-07-19",
    "time": "19.07.2025 01:52:55 UTC+01:00"
  },
  {
    "text": "Це вже зовсім інше у порівнянні з класичним ліво/право!",
    "date": "2025-07-19",
    "time": "19.07.2025 01:53:49 UTC+01:00"
  },
  {
    "text": "Те що всьо то стерео, точне визначення у просторі та обʼєм зникає зроби ти крок у ліво або право від акустичного центру.",
    "date": "2025-07-19",
    "time": "19.07.2025 02:33:01 UTC+01:00"
  },
  {
    "text": "Так це мій опис обʼєму який теж зникає коли ти не в акустичному центрі між порталами ліво/право",
    "date": "2025-07-19",
    "time": "19.07.2025 02:41:54 UTC+01:00"
  },
  {
    "text": "Може комусь і змінюється але для мене зникає бо ефект взагалі не той самий коли ти точно у акустичному центрі. І навіть затримка 1+ мс змінює місце для акустичного центра.",
    "date": "2025-07-19",
    "time": "19.07.2025 02:55:40 UTC+01:00"
  },
  {
    "text": "В тому і річ яку ти так і не зміг зрозуміти з його посту - це не справжнє стерео, і у міксах та інженерії для живого звуку є поняття як подвійне моно, яке не має нічого спільного з визначенням яке ти знаходиш у Вікіпедії!",
    "date": "2025-07-19",
    "time": "19.07.2025 03:07:55 UTC+01:00"
  },
  {
    "text": "Крім поняття з Вікіпедії - дабл моно ще може відноситись до мікшування або конфігурації/дизайну РА у залі що все одне більше відноситься до стилю мікшування.",
    "date": "2025-07-19",
    "time": "19.07.2025 03:44:01 UTC+01:00"
  },
  {
    "text": "В тому і справа що стерео трек не береш, бо розмова іде про мікшування живих музикантів без треків. Але напевно то важко зрозуміти!",
    "date": "2025-07-19",
    "time": "19.07.2025 03:47:20 UTC+01:00"
  },
  {
    "text": "Моно це не краще що може бути, але у порівнянні з класичним стерео ліво/право - так, краще!Класичне стерео ліво/право взагалі має багато недоліків для живих виступів у порівнянні  з моно або іншими імплементаціями імерсів сетапів!",
    "date": "2025-07-19",
    "time": "19.07.2025 04:22:45 UTC+01:00"
  },
  {
    "text": "Ну якщо приміщення церкви трохи більше зали у стандартній квартирі- то так стерео почують більшість відвідувачів зібрання!Ну а далі вже починаються перевзування у повітрі від Вови що в його церкві стерео чують всі на всіх місцях…",
    "date": "2025-07-19",
    "time": "19.07.2025 04:50:51 UTC+01:00"
  },
  {
    "text": "Майже доробив мережу в храмі, сервак всг тепер в підвалі, дропів і помилок немає, наче все норм працює",
    "date": "2025-07-19",
    "time": "19.07.2025 16:40:29 UTC+01:00"
  },
  {
    "text": "Не норм, бо мікрофон не стерео!",
    "date": "2025-07-19",
    "time": "19.07.2025 18:59:43 UTC+01:00"
  },
  {
    "text": "Рівно під таргет?! А який таргет? 😁",
    "date": "2025-07-19",
    "time": "19.07.2025 20:26:24 UTC+01:00"
  },
  {
    "text": "Цікаво 🤔 тільки навіщо для магнітуди таргет та для фази?",
    "date": "2025-07-19",
    "time": "19.07.2025 20:39:03 UTC+01:00"
  },
  {
    "text": "Не вірно зрозумів - магнітуда показує відхилення від референс сигналу. Наприклад якщо вимірюваний сигнал співпадає з референсним сигналом то на магнітуді буде пряма лінія що вказує на те що відхилення вимірювання від рефренсу не має.Референсним сигналом може бути будь що - рожевий шум, білий шум,...",
    "date": "2025-07-19",
    "time": "19.07.2025 21:35:38 UTC+01:00"
  },
  {
    "text": "Тобі спочатку треба самому визначитись, бо раніше ти стверджував що стерео то різні сигнали в ліво/право, а зараз знов перевзувся щоб не визнавати що був не правий 😂",
    "date": "2025-07-21",
    "time": "21.07.2025 00:15:50 UTC+01:00"
  },
  {
    "text": "Твої визначення не мають обґрунтування та не витримують критики!Ще один критичний пункт - “Якщо в лівій і правій АС звучать різні сигнали — це ще не стерео, це два незалежних джерела звуку.”\"Тут важлива психоакустика: мозок формує “стерео-образ” лише за умови:• одночасності звучання• подібності м...",
    "date": "2025-07-21",
    "time": "21.07.2025 00:30:36 UTC+01:00"
  },
  {
    "text": "Відповідає, але чутно це стерео буде лише по центру між акустичними системами ліво/право! Але ніяк всюди навіть у малому залі бо різниця у інтенсивності/відчувана гучність та різниця у часі впливає на загальний план/сцену стерео!І як сказа жпт - \"У реальних умовах (особливо у великих залах) добре...",
    "date": "2025-07-21",
    "time": "21.07.2025 00:41:46 UTC+01:00"
  },
  {
    "text": "Не обовʼязково, бо як сказано у дописи в залежності від настрої композиції та музикантів - гітара може бути одним каналом або мікс з двох каналів, або  максимум ліво, або максимум право і тоді це вже повноцінне дуал моно як сам Лі і зазначаєʼ",
    "date": "2025-07-21",
    "time": "21.07.2025 00:46:37 UTC+01:00"
  },
  {
    "text": "Цілісний мікс та суцільну композицію/сцену чує меншість людей у залі, при ідеальних умовах це максимум біля 20% що знаходяться у центрі між ліво та право!",
    "date": "2025-07-21",
    "time": "21.07.2025 00:53:56 UTC+01:00"
  },
  {
    "text": "Бо розмова іде зовсім про інше!Мої біля 20 відсотків це теоритичні розрахунки при ідеальних умовах, яких не існує у церквах та у інших приміщення! Тож більш реальний результат це 10 максимум 15 відсотків, що при максимально правильній посадці, якої теж не існує, у залі де наповненість по людях 10...",
    "date": "2025-07-21",
    "time": "21.07.2025 01:01:08 UTC+01:00"
  },
  {
    "text": "Будь ласка! Математично це ще не реальний світ, то ж це взагалі не має значення доводити ! Математично в тебе твої портали/ліво право не виходять з вікна 5мс, але якщо взяти балон моделі твоіх акустичних систем та зробити симуляцію - навіть прямий звук від акустичних систем вийде за це вікно.Хоча...",
    "date": "2025-07-21",
    "time": "21.07.2025 01:09:35 UTC+01:00"
  },
  {
    "text": "Скоріше за все так і є - викривлення простору та часу де виникає не порозуміння коли до прикладу живого міксу наводять один інструмент або студійний трек який скоріше за все не є моно сумісним та при перемиканні у моно зникає обʼєм та з цього роблять висновок що моно мікс не може бути обʼємним у ...",
    "date": "2025-07-21",
    "time": "21.07.2025 01:30:05 UTC+01:00"
  },
  {
    "text": "Ти ж ніколи не визнаєш того що є велика вірогідність того що при перемиканні таких джерел у моно зникають фазові спотворення, сатурація або інші художні ефекти які були у каналі джерела до якого ти знаходишся ближче. Але при перемиканні у моно такі художні деталі зникають тому що здебільшого вони...",
    "date": "2025-07-21",
    "time": "21.07.2025 01:53:55 UTC+01:00"
  },
  {
    "text": "Вел, тугезер бікоз - логіка у тому що велика вірогідність у тому що обʼєм про який ти кажеш додає не іншій випромінювач, а саме сигнал у тому до якого ти знаходишся ближче. Але при перемиканні у моно або якщо зробити суму таких каналів всі ті спотворення зникають бо здебільшого вони побудовані на...",
    "date": "2025-07-21",
    "time": "21.07.2025 02:14:44 UTC+01:00"
  },
  {
    "text": "У реальних умовах добре зроблений моно-мікс часто звучить навіть більш сфокусовано і «повніше», ніж спотворене стерео.Комб фільтр у кожному місці залу буде різний і його деструктивний вплив це взагалі не така велика проблема, як ти зазначаєш!",
    "date": "2025-07-21",
    "time": "21.07.2025 04:23:16 UTC+01:00"
  },
  {
    "text": "Дякую брате! Я мабуть теж би дав тобі поради яку ніхто просив але утримуюсь!",
    "date": "2025-07-21",
    "time": "21.07.2025 07:41:23 UTC+01:00"
  },
  {
    "text": "То я більше угараю з тих хто не проходе мимо і дає поради не по темі 😂Та і взагалі у мене вихідний день був і тільки зараз ніч починається 😁",
    "date": "2025-07-21",
    "time": "21.07.2025 07:51:49 UTC+01:00"
  },
  {
    "text": "Сам пожартував і сам посміявся..",
    "date": "2025-07-21",
    "time": "21.07.2025 07:53:19 UTC+01:00"
  },
  {
    "text": "Дуже жаль що це все що є тобі сказати, навіть не по темі..",
    "date": "2025-07-21",
    "time": "21.07.2025 07:56:51 UTC+01:00"
  },
  {
    "text": "Тут можна в контексті і без контексту, правил нема!",
    "date": "2025-07-21",
    "time": "21.07.2025 08:10:12 UTC+01:00"
  },
  {
    "text": "Бо треба свою голову мати на плечах, а не чекати коли хтось зробе за тебе висновки та скаже як тобі треба жити або що робити..Якщо маєш то роби свої висновки з того, а якщо хочеш щось зробити для громади чату, а не просто бути глядачем - то хочаб поділись своїми висновками!",
    "date": "2025-07-21",
    "time": "21.07.2025 11:12:19 UTC+01:00"
  },
  {
    "text": "Тут є не тільки специ, ще й \"фірмачі\" !Але замовлення починають від 1000 гривнів, потягнеш?!",
    "date": "2025-07-21",
    "time": "21.07.2025 11:21:34 UTC+01:00"
  },
  {
    "text": "Ну то сиди і читай далі! 😁",
    "date": "2025-07-21",
    "time": "21.07.2025 11:23:14 UTC+01:00"
  },
  {
    "text": "Просто для  розуміння історичного контексту - нащо оті дурні Grateful Dead робили the wall of sound ?!",
    "date": "2025-07-21",
    "time": "21.07.2025 11:26:55 UTC+01:00"
  },
  {
    "text": "Я б і з тобою посперечався але…",
    "date": "2025-07-21",
    "time": "21.07.2025 11:29:56 UTC+01:00"
  },
  {
    "text": "Чому не відкриті простори, бо the wall of sound був створений лише на відкритих просторах?!Також інші експерименти з імерсів набагато простіше зробити на відкритих майданчиках, бо спотворення та відбиття приміщення вносять свої деструктивні зміни..",
    "date": "2025-07-21",
    "time": "21.07.2025 11:32:23 UTC+01:00"
  },
  {
    "text": "Якщо вивчати  історію то буде зрозуміло чому - як самий простіший і загалом не як кращій…",
    "date": "2025-07-21",
    "time": "21.07.2025 11:39:40 UTC+01:00"
  },
  {
    "text": "Саме тому зараз і новий цикл з цим всім імерсив…",
    "date": "2025-07-21",
    "time": "21.07.2025 11:42:30 UTC+01:00"
  },
  {
    "text": "Нема настільки ефективних колонок у плані покриття всього залу, тому доводиться застосовувати декілька щоб закрити всю площину посадки аудиторії",
    "date": "2025-07-21",
    "time": "21.07.2025 11:44:39 UTC+01:00"
  },
  {
    "text": "Тут важливий програмний матеріал! Якщо це тільки спікер - то ок! Але якщо потрібна більша гучність та динаміка - Соррі вже ніяк один спікер або масив не витягне…",
    "date": "2025-07-21",
    "time": "21.07.2025 11:48:44 UTC+01:00"
  },
  {
    "text": "Для церкви то зрозуміло, але для концертів/шоу - як таке витягнути одним спікером та зробити покриття залу одним спікером або порталом ?!",
    "date": "2025-07-21",
    "time": "21.07.2025 11:50:19 UTC+01:00"
  },
  {
    "text": "Тому ліво/право це такий невдалий компроміс",
    "date": "2025-07-21",
    "time": "21.07.2025 11:52:51 UTC+01:00"
  },
  {
    "text": "Залежить від програмного матеріалу, та наскільки важливо зробити рівномірне покриття!Якщо це церква де літургія побудована лише на спікері та камерному звучанні хору то вистачить лише одного джерела",
    "date": "2025-07-21",
    "time": "21.07.2025 11:54:21 UTC+01:00"
  },
  {
    "text": "Ну і ще фізика - якщо би був рівномірний тиск від осі випромінювання було б взагалі аГінь!",
    "date": "2025-07-21",
    "time": "21.07.2025 11:58:31 UTC+01:00"
  },
  {
    "text": "Сам пожартував….",
    "date": "2025-07-21",
    "time": "21.07.2025 12:00:18 UTC+01:00"
  },
  {
    "text": "Класичне L-R стерео для живих виступів це взагалі обмежений компроміс. Гібридний моно мікс на таких системах звучит набагато краще, більш обʼємним та цікавіше для більшості місць у залі ніж компромісне псевдо стерео.",
    "date": "2025-07-21",
    "time": "21.07.2025 12:07:45 UTC+01:00"
  },
  {
    "text": "Та заспокойся вже, тобі лише той хайп, вимахуватись та перевзуватись треба!",
    "date": "2025-07-21",
    "time": "21.07.2025 12:14:30 UTC+01:00"
  },
  {
    "text": "Вже сто разів таке було, нічого цікавого крім мого треку не було у тих конкурсах! 😉",
    "date": "2025-07-21",
    "time": "21.07.2025 12:21:16 UTC+01:00"
  },
  {
    "text": "Не зрозуміло питання!що саме еквалізувати, для чого еквалізувати і нащо фільтри якщо система вже з фільтрами від виробника…",
    "date": "2025-07-21",
    "time": "21.07.2025 12:25:03 UTC+01:00"
  },
  {
    "text": "Нічого страшного, витримаєш! Зможеш, я в тебе вірю! 😘",
    "date": "2025-07-21",
    "time": "21.07.2025 12:26:56 UTC+01:00"
  },
  {
    "text": "Ну класс, і що мені треба з цим робити чи як це відноситься до запитання?",
    "date": "2025-07-21",
    "time": "21.07.2025 12:29:05 UTC+01:00"
  },
  {
    "text": "Я б не робив!",
    "date": "2025-07-21",
    "time": "21.07.2025 12:30:22 UTC+01:00"
  },
  {
    "text": "Попроси Вову, він вам зробе коаксіали що на 10 метрів грають! Будуть таки тільки в вас та в Чернівцях 😂",
    "date": "2025-07-21",
    "time": "21.07.2025 12:32:07 UTC+01:00"
  },
  {
    "text": "Спочатку зробити пресет/налаштування у камері або хочаб полу просторі. Це якщо відсутня інформація від виробника. Але зробити пресет, навіть я таким не займаюся, бо треба мати прям дуже багато досвіду з дизайну та виготовлення акустичних систем плюс досвід у розробці пресетів.",
    "date": "2025-07-21",
    "time": "21.07.2025 12:36:43 UTC+01:00"
  },
  {
    "text": "Хоча мені іноді такі історії розказують що в мене очі лізуть на лоба…Наприклад один \"гуру\" з західного міста приїхав до відомої студії у столиці та виправляв різне звучання студійних моніторів за допомогою DSP у підсилювачі від стороннього виробника, просто були вбиті випромінювачі в одному з мон...",
    "date": "2025-07-21",
    "time": "21.07.2025 12:44:00 UTC+01:00"
  },
  {
    "text": "Вух… дочитав), так що там по конкурсу?)",
    "date": "2025-07-21",
    "time": "21.07.2025 13:27:45 UTC+01:00"
  },
  {
    "text": "Таке життя",
    "date": "2025-07-21",
    "time": "21.07.2025 14:05:01 UTC+01:00"
  },
  {
    "text": "Та тут багато хто таке казав, а виграють ті що кажуть що програють))",
    "date": "2025-07-21",
    "time": "21.07.2025 14:11:53 UTC+01:00"
  },
  {
    "text": "А посилання на такі труси кинеш?)",
    "date": "2025-07-21",
    "time": "21.07.2025 14:48:13 UTC+01:00"
  },
  {
    "text": "Не дякуй, ти ж і не просив допомоги!",
    "date": "2025-07-21",
    "time": "21.07.2025 19:19:09 UTC+01:00"
  },
  {
    "text": "То є добрий кандидат на денс мікс!",
    "date": "2025-07-21",
    "time": "21.07.2025 19:26:23 UTC+01:00"
  },
  {
    "text": "У цьому чаті хороша думка про мене є виключення, то ж будь у мейнстрім!",
    "date": "2025-07-21",
    "time": "21.07.2025 19:36:01 UTC+01:00"
  },
  {
    "text": "Де такий  брат або сестра що не мають щоденної поживи?! То ж подумай- сам! 😁",
    "date": "2025-07-21",
    "time": "21.07.2025 19:40:25 UTC+01:00"
  },
  {
    "text": "Я теж вважаю що треба підтримувати мейнстрім та йти разом з натовпом!",
    "date": "2025-07-21",
    "time": "21.07.2025 19:48:41 UTC+01:00"
  },
  {
    "text": "Зміст в тому що людині потрібна первісна допомога  тобто вона знаходиться у первинній побутовій проблемі.Церковна маніпуляція у тому що такими способами маніпулюють у проповідях зміняючи та протиставляючи первинну потребу звичайній потребі, але суть не звичайних потребах - суть втому що людина зн...",
    "date": "2025-07-21",
    "time": "21.07.2025 20:02:39 UTC+01:00"
  },
  {
    "text": "Хто такий Ісус?!",
    "date": "2025-07-21",
    "time": "21.07.2025 20:20:51 UTC+01:00"
  },
  {
    "text": "Йєшуа знаю, Ісус ніт…",
    "date": "2025-07-21",
    "time": "21.07.2025 20:23:28 UTC+01:00"
  },
  {
    "text": "Нужда це коли комусь потрібна медична допомога або нема чого їсти, чи де жити )Як таке можна виправдовувати та як це може бути нуждою для церковної громади або служіння - доки що не зрозуміло… 😁",
    "date": "2025-08-06",
    "time": "06.08.2025 16:46:02 UTC+01:00"
  },
  {
    "text": "Нема тут ніякого питання, це просто виправдовування хитрої сраки 😁",
    "date": "2025-08-06",
    "time": "06.08.2025 17:16:21 UTC+01:00"
  },
  {
    "text": "Я памʼятаю що мені нумер два сподобався! Треку не вистачило технічних вмінь та вмінь редагування але мені сподобалась творча ідея і що трек дихає/має динаміку у музиці, саме цього мені не вистачало у інших конкурсних роботах!Але тут постає інше питання - якщо зробити редагування, частотну та дина...",
    "date": "2025-08-06",
    "time": "06.08.2025 18:14:49 UTC+01:00"
  },
  {
    "text": "А що був такий чувак?!",
    "date": "2025-08-06",
    "time": "06.08.2025 18:32:20 UTC+01:00"
  },
  {
    "text": "Дуже мало людей приймає участь, якось не цікаво стає ((",
    "date": "2025-08-06",
    "time": "06.08.2025 20:07:52 UTC+01:00"
  },
  {
    "text": "Так давайте гарний мультитрек і з понеділка усі приймаємо участь",
    "date": "2025-08-06",
    "time": "06.08.2025 20:24:13 UTC+01:00"
  },
  {
    "text": "Якась піраміда",
    "date": "2025-08-06",
    "time": "06.08.2025 20:50:36 UTC+01:00"
  },
  {
    "text": "Конкурс же не із за бабок",
    "date": "2025-08-06",
    "time": "06.08.2025 20:51:44 UTC+01:00"
  },
  {
    "text": "Та можна, тож просто щоб якийсь приз був",
    "date": "2025-08-06",
    "time": "06.08.2025 20:54:44 UTC+01:00"
  },
  {
    "text": "Та давай вже тоді  округлемо до -10",
    "date": "2025-08-12",
    "time": "12.08.2025 10:56:17 UTC+01:00"
  },
  {
    "text": "Ти про закінчений варіант?",
    "date": "2025-08-12",
    "time": "12.08.2025 11:00:26 UTC+01:00"
  },
  {
    "text": "Та ну звісно, коли ти профі, навчався  у нармальних людей живеш  цим, а не як макака сам на пульті щось тикаєш по відосам з ютуба, і то коли зʼявляється час між роботою, служіннями і сімʼєю",
    "date": "2025-08-12",
    "time": "12.08.2025 11:05:14 UTC+01:00"
  },
  {
    "text": "Так і я ж про це)",
    "date": "2025-08-12",
    "time": "12.08.2025 11:07:19 UTC+01:00"
  },
  {
    "text": "https://www.instagram.com/p/DMvj-MxAgNb/?igsh=Ym9vemtham8wdTc2",
    "date": "2025-08-12",
    "time": "12.08.2025 20:41:24 UTC+01:00"
  },
  {
    "text": "Авжеж до останнього ))",
    "date": "2025-08-12",
    "time": "12.08.2025 20:54:08 UTC+01:00"
  },
  {
    "text": "Оо а є така щоб 30-45 мс?? Було б саме то для нашого басиста)",
    "date": "2025-08-14",
    "time": "14.08.2025 09:17:40 UTC+01:00"
  },
  {
    "text": "Якщо збільшувати діапазон інтенсивності то крякозябра перетворюється на лінійну АЧХ!",
    "date": "2025-08-14",
    "time": "14.08.2025 10:32:47 UTC+01:00"
  },
  {
    "text": "Саме тому тобі потрібно бути обережним!Мені - ніт, бо мій жпт покаявся! Хоча він просто підлабузник, та так само перегортається у повітрі та контексті як і ти Вова!https://chatgpt.com/s/t_689da76edc8c819194d49ffe0822417dhttps://chatgpt.com/s/t_689da58925f481918db2fd4d9df6e72b",
    "date": "2025-08-14",
    "time": "14.08.2025 11:10:51 UTC+01:00"
  },
  {
    "text": "Та то і видно що визнання своїх помилок тебе тригерить так що ти не бачиш контексту та  свого перегортання у повітрі! 😁",
    "date": "2025-08-14",
    "time": "14.08.2025 11:33:07 UTC+01:00"
  },
  {
    "text": "Цікаво, ти вже сам собі питання ставиш, але все одне від мене! 😁",
    "date": "2025-08-14",
    "time": "14.08.2025 11:37:47 UTC+01:00"
  },
  {
    "text": "Цікаво, не вже такого великого акю вистачає тільки на таке? 🤔",
    "date": "2025-08-14",
    "time": "14.08.2025 11:42:54 UTC+01:00"
  },
  {
    "text": "Це мій стейтмент та лайф стайл!А тобі зовсім інший варіант підходить!",
    "date": "2025-08-14",
    "time": "14.08.2025 11:54:34 UTC+01:00"
  },
  {
    "text": "Ніт, просто нарешті взяли працювати у Дісней - Мікі Маусом з вмінням володіння клей пістолетом найвищого рівня!",
    "date": "2025-08-14",
    "time": "14.08.2025 11:58:55 UTC+01:00"
  },
  {
    "text": "Становиться трішки краще але він все одно казки починає вигадувати",
    "date": "2025-08-14",
    "time": "14.08.2025 12:18:49 UTC+01:00"
  },
  {
    "text": "Ти хочеш оригінал скинути?)",
    "date": "2025-08-14",
    "time": "14.08.2025 14:37:26 UTC+01:00"
  },
  {
    "text": "Ну якщо ти їх в урну викинув то звісно що лягло)))",
    "date": "2025-08-14",
    "time": "14.08.2025 16:05:34 UTC+01:00"
  },
  {
    "text": "Я обійшовся вейвс, фабфільтром і А.О.М.",
    "date": "2025-08-14",
    "time": "14.08.2025 16:10:58 UTC+01:00"
  },
  {
    "text": "Маштабуеш дороги і вибираєш шматок наприклад де видно удар снеера, і рухаєш щоб всі зійшлись, але тут не у всіх карауданх добре видно, тому ті на яких не видно з ними прийшлось гратись, наприклад  змінюєш полярність і рухаєшся, шукаєш де більше вичітается",
    "date": "2025-08-14",
    "time": "14.08.2025 16:22:38 UTC+01:00"
  },
  {
    "text": "Не точно, але мені так більше довподоби",
    "date": "2025-08-14",
    "time": "14.08.2025 16:24:40 UTC+01:00"
  },
  {
    "text": "Ну я ж самоучка, тому можна мене не слухати))",
    "date": "2025-08-14",
    "time": "14.08.2025 16:27:53 UTC+01:00"
  },
  {
    "text": "Ну теж варіант но між собою всеодно треба їх сфазувати і знаті їх затримку  з оригіналом щоб приділей в темп виставити",
    "date": "2025-08-14",
    "time": "14.08.2025 16:31:47 UTC+01:00"
  },
  {
    "text": "Та ні,, так не цікаво",
    "date": "2025-08-14",
    "time": "14.08.2025 16:33:40 UTC+01:00"
  },
  {
    "text": "Так то можна і після конкурсу",
    "date": "2025-08-14",
    "time": "14.08.2025 16:34:25 UTC+01:00"
  },
  {
    "text": "Це ти про що?",
    "date": "2025-08-14",
    "time": "14.08.2025 19:39:59 UTC+01:00"
  },
  {
    "text": "Ах ти ж еті теті",
    "date": "2025-08-14",
    "time": "14.08.2025 19:41:37 UTC+01:00"
  },
  {
    "text": "Я вже забув то давно було, але тільки виклали",
    "date": "2025-08-14",
    "time": "14.08.2025 19:42:04 UTC+01:00"
  },
  {
    "text": "Нащо ти мене викликав?!",
    "date": "2025-08-14",
    "time": "14.08.2025 21:50:14 UTC+01:00"
  },
  {
    "text": "Там нічого розумного нема! Дивись далі!",
    "date": "2025-08-14",
    "time": "14.08.2025 21:51:03 UTC+01:00"
  },
  {
    "text": "Як це панімать - \"редагує мужик мікшує\" ?!",
    "date": "2025-08-14",
    "time": "14.08.2025 21:56:34 UTC+01:00"
  },
  {
    "text": "І що?! Це ж \"срака контроль\" називається!",
    "date": "2025-08-14",
    "time": "14.08.2025 21:58:38 UTC+01:00"
  },
  {
    "text": "Коли по ділу то так і виходить що є за що блейміти!Олександр визнає що може не знати як зробити краще та робе як воно виходе.А є ті хто вихоплює з контексту тільки те що їм потрібно щоб виправдати своє розуміння - як у прикладі з гітарами які чомусь стали стерео і чомусь стали ліво та право, хоча...",
    "date": "2025-08-14",
    "time": "14.08.2025 22:07:01 UTC+01:00"
  },
  {
    "text": "Ти знов все перевернув та висмикнув з контексту!Я визнав лише твій приклад/пояснення що то може бути стерео.",
    "date": "2025-08-14",
    "time": "14.08.2025 22:15:20 UTC+01:00"
  },
  {
    "text": "Нема суті - який зал, яка система та кількість, який тип вимірювань…Яке запитання така й відповідь!",
    "date": "2025-08-14",
    "time": "14.08.2025 22:17:39 UTC+01:00"
  },
  {
    "text": "Ти що мені то інтервʼю з відео хочеш продовжити?! Досить вже абстрактні питання ставити!",
    "date": "2025-08-14",
    "time": "14.08.2025 22:23:22 UTC+01:00"
  },
  {
    "text": "Я ж і кажу - яке питання така і відповідь!",
    "date": "2025-08-14",
    "time": "14.08.2025 22:25:15 UTC+01:00"
  },
  {
    "text": "Ми обговорювали взагалі інший пост де у опису є пояснення як у більшості ситуацій застосовуються ті канали.Але ж тобі прям так треба що готовий висмоктувати різні пости та коментарі лише б виправдатись.",
    "date": "2025-08-14",
    "time": "14.08.2025 22:36:12 UTC+01:00"
  },
  {
    "text": "Мьют вокальні мікрофони 😁",
    "date": "2025-08-14",
    "time": "14.08.2025 22:37:01 UTC+01:00"
  },
  {
    "text": "Треба бути уважним!",
    "date": "2025-08-14",
    "time": "14.08.2025 22:39:17 UTC+01:00"
  },
  {
    "text": "Орган слуху як мінімум у 30К разів має більшу роздільну здатність ніж будь яки виміри та тести.По деяких параметрах взагалі не можливо зробити виміри або тести - тому треба розуміти як ти чуєш, що чуєш та як цю інформацію інтерпретуєш. Так само як і з вимірами- треба розуміти що воно тобі каже і ...",
    "date": "2025-08-14",
    "time": "14.08.2025 23:09:10 UTC+01:00"
  },
  {
    "text": "Той жбл журба, а не масив, як і т12 😢",
    "date": "2025-09-15",
    "time": "15.09.2025 02:43:32 UTC+01:00"
  },
  {
    "text": "До речі там ж у Чернівцях альтернативна фізика/реальність, то ті жбл були б агІнь 🔥",
    "date": "2025-09-15",
    "time": "15.09.2025 05:07:58 UTC+01:00"
  },
  {
    "text": "В Одесі загалом є цілий район - фонтан ⛲️",
    "date": "2025-09-15",
    "time": "15.09.2025 06:25:38 UTC+01:00"
  },
  {
    "text": "Це констатація фактів чи питання?!",
    "date": "2025-09-15",
    "time": "15.09.2025 08:05:39 UTC+01:00"
  },
  {
    "text": "Просто я вечеряю або обідаю декілька разів на тиждень з тим кому належить той комплект звуку що був до сьогодні в хілсонг, а також інший комплект звуку який приїхав сьогодні замість того що був раніше 😉То ж це трохи буває такий інсайд з різних джерел і не тільки за звук у хілсонгу але й багато чо...",
    "date": "2025-09-15",
    "time": "15.09.2025 10:10:15 UTC+01:00"
  },
  {
    "text": "Як це панІмать?!",
    "date": "2025-09-15",
    "time": "15.09.2025 10:12:27 UTC+01:00"
  },
  {
    "text": "Може тому що це не звук хілсонгу, достатньо детально?!",
    "date": "2025-09-15",
    "time": "15.09.2025 10:15:25 UTC+01:00"
  },
  {
    "text": "Я більше за варіант - бо не платили за аренду та користувалися по благодаті 😉",
    "date": "2025-09-15",
    "time": "15.09.2025 10:18:08 UTC+01:00"
  },
  {
    "text": "Тому по благодаті приїхав інший комплект, а той що був поїхав робити бабки 😁",
    "date": "2025-09-15",
    "time": "15.09.2025 10:19:16 UTC+01:00"
  },
  {
    "text": "Тепер будеш цей комплект розчехляти декілька років 😂",
    "date": "2025-09-15",
    "time": "15.09.2025 10:22:57 UTC+01:00"
  },
  {
    "text": "Розумію, то є дуже важкий матеріал для поціновувачів французьких круасанів!",
    "date": "2025-09-15",
    "time": "15.09.2025 10:44:26 UTC+01:00"
  },
  {
    "text": "То прям журба жбл- його прям дуже мало, а комплектація просто печально неймовірна 😢",
    "date": "2025-09-15",
    "time": "15.09.2025 10:52:42 UTC+01:00"
  },
  {
    "text": "Від тебе точно не приходило! Нема жодного поповнення банки від жодного Володимира, то ж не треба тут плакатися!",
    "date": "2025-09-15",
    "time": "15.09.2025 20:28:38 UTC+01:00"
  },
  {
    "text": "Всі учасники додають інформацію та не уникають навмисно своєї ідентифікації при поповненні банки.То ж ти так само міг це зробити! 😉",
    "date": "2025-09-15",
    "time": "15.09.2025 20:38:20 UTC+01:00"
  },
  {
    "text": "Ой, взагалі не цікаво, чути хто та що міг би зробити щоб тебе це влаштувало!",
    "date": "2025-09-15",
    "time": "15.09.2025 20:48:51 UTC+01:00"
  },
  {
    "text": "То було не зовсім запитання, але це можна розглядати як запит на ідентифікацію який Вова не пройшов!І це було ще до видалення!",
    "date": "2025-09-15",
    "time": "15.09.2025 20:57:06 UTC+01:00"
  },
  {
    "text": "То 4 мс у чернівецький реальності, бо у нормальному всесвіті то більше 10 хвилин 🤭",
    "date": "2025-09-15",
    "time": "15.09.2025 21:16:48 UTC+01:00"
  },
  {
    "text": "Не звертай уваги то хайп чернівецьких гуру яким не вистачає уваги та визнання 😁",
    "date": "2025-09-15",
    "time": "15.09.2025 21:20:28 UTC+01:00"
  },
  {
    "text": "Написал в лс",
    "date": "2025-09-23",
    "time": "23.09.2025 16:10:39 UTC+01:00"
  },
  {
    "text": "1. Драм шілд не туди поставили!2. Жас бас гітари нема!Аматорський рівень!",
    "date": "2025-09-23",
    "time": "23.09.2025 16:59:00 UTC+01:00"
  },
  {
    "text": "О, ніт! Дякую!",
    "date": "2025-09-23",
    "time": "23.09.2025 17:05:30 UTC+01:00"
  },
  {
    "text": "Дякую, ніт!",
    "date": "2025-09-23",
    "time": "23.09.2025 17:06:21 UTC+01:00"
  },
  {
    "text": "Було і таке!",
    "date": "2025-09-23",
    "time": "23.09.2025 17:19:00 UTC+01:00"
  },
  {
    "text": "Відео нема, бо багато чого не можна знімати та й я ще зі старої школи де є негласне технічне табу на знімки/відео.",
    "date": "2025-09-23",
    "time": "23.09.2025 17:25:24 UTC+01:00"
  },
  {
    "text": "Син мого равіна грає у них, але не цього разу 😁",
    "date": "2025-09-23",
    "time": "23.09.2025 18:16:18 UTC+01:00"
  },
  {
    "text": "послухай оце, може тебе відпусте )))https://www.youtube.com/watch?v=PX0e0Cn3SPE",
    "date": "2025-09-23",
    "time": "23.09.2025 18:26:54 UTC+01:00"
  },
  {
    "text": "Що ти палиш!",
    "date": "2025-09-23",
    "time": "23.09.2025 18:42:35 UTC+01:00"
  },
  {
    "text": "Так о тож - \"не только лиш все могут смотреть…\"",
    "date": "2025-09-23",
    "time": "23.09.2025 18:46:33 UTC+01:00"
  },
  {
    "text": "Не можуть церкви дозволити виписувати собі на трансляцію інженера який робить етери у Lakewood Church та окрему бродкаст консоль, а якщо можуть то не всі! 😆",
    "date": "2025-09-23",
    "time": "23.09.2025 18:50:04 UTC+01:00"
  },
  {
    "text": "А на нормальному контролі чутно як воно все розвалюється/окремо грає динамічно та нема клею на міксі?Воно все окремо звучить гарно, але томікі та тригери вилітають не сидять у міксі. Попереду вокал та барабани інші інструменти стирчать але все окремо нема загалом картини 🖼️Бо у мене в машині все ...",
    "date": "2025-09-23",
    "time": "23.09.2025 18:59:37 UTC+01:00"
  },
  {
    "text": "Таке враження що навчились робити барабани тому вони завжди попереду, ну а вокал треба теж попереду бо лише барабани які я навчився робити не можна залишити самі, та і лідери будуть не задоволені якщо вокалу не буде попереду 😂😆",
    "date": "2025-09-23",
    "time": "23.09.2025 19:12:37 UTC+01:00"
  },
  {
    "text": "Зажатий \"лослес\" з ютуба або спотіфай?",
    "date": "2025-09-23",
    "time": "23.09.2025 21:03:05 UTC+01:00"
  },
  {
    "text": "flac/alac відрізняються від CD особливо коли слухаєш на сетапах де є велика динаміка та гучність )НЧ то взагалі бідося у flac/alac, звичайно не мр3 але прям втрачає дихання суттєво!",
    "date": "2025-09-23",
    "time": "23.09.2025 21:20:00 UTC+01:00"
  },
  {
    "text": "Тому я не розумію як можна використовувати їх як рефернс для тесту аудіо систем!",
    "date": "2025-09-23",
    "time": "23.09.2025 21:34:32 UTC+01:00"
  },
  {
    "text": "Ладно ок якщо це компорат говорильня, але як можна використовувати як референс для міксу лайв музикантів…",
    "date": "2025-09-23",
    "time": "23.09.2025 21:36:13 UTC+01:00"
  },
  {
    "text": "То навіть якщо аналізатором спектру АчХ подивитись то майже не буде різниці, а на слух різниця дуже велика!Але так, не будемо вірити та тренувати свій слух - довіряємо лише приладам !",
    "date": "2025-09-23",
    "time": "23.09.2025 21:47:55 UTC+01:00"
  },
  {
    "text": "Не знаю що там без втрат, але різницю по звуку я чую! Особливо у динаміці по НЧ, це мій субʼєктивний досвід, але він схожий з багатьма іншими аудіо фахівцями!",
    "date": "2025-09-23",
    "time": "23.09.2025 21:52:16 UTC+01:00"
  },
  {
    "text": "Та я ж і кажу що по RTA аналізатору мр3 теж майже не відрізняється від wav! То все шарлатанство зі слухом, прибори не брешуть! 😉",
    "date": "2025-09-23",
    "time": "23.09.2025 22:01:05 UTC+01:00"
  },
  {
    "text": "То ти вже подивився?!",
    "date": "2025-09-26",
    "time": "26.09.2025 17:15:13 UTC+01:00"
  },
  {
    "text": "Він стільки всього розказував але так і не  зрозумів для себе чому на його ТС пасочке вихід для навушників з високим опором 😂І потім ще каже що на apple вистачає струму качати навушники з високим опором! 😂",
    "date": "2025-09-26",
    "time": "26.09.2025 17:19:50 UTC+01:00"
  },
  {
    "text": "Ну цей ютуб тип взагалі стрьомний та небезпечній!",
    "date": "2025-09-26",
    "time": "26.09.2025 17:50:04 UTC+01:00"
  },
  {
    "text": "Та куди там! гуру чернівецькій сказав що це моя проблема якщо у декодерів флак різні енджини і вони не вірно декодують…",
    "date": "2025-09-26",
    "time": "26.09.2025 17:52:51 UTC+01:00"
  },
  {
    "text": "То було не тільки у АЧХ, по низу відразу помітно що динаміка зовсім інша.Але не зволікайте - такого не може бути це крінж!",
    "date": "2025-09-26",
    "time": "26.09.2025 18:21:55 UTC+01:00"
  },
  {
    "text": "Чесно не памʼятаю вже  🤷‍♂️",
    "date": "2025-09-26",
    "time": "26.09.2025 18:25:43 UTC+01:00"
  },
  {
    "text": "Де саме я відмовляюсь?",
    "date": "2025-09-26",
    "time": "26.09.2025 18:38:15 UTC+01:00"
  },
  {
    "text": "А від чого ти мене рятуєш?!",
    "date": "2025-09-26",
    "time": "26.09.2025 18:53:01 UTC+01:00"
  },
  {
    "text": "Лінь — така риба, що її легше вигадати, ніж упіймати! Тож не дивно, що й твої думки вислизають так само легко!",
    "date": "2025-09-26",
    "time": "26.09.2025 19:33:00 UTC+01:00"
  },
  {
    "text": "Так можна не заморочуватись коли в тебе моніторинг посередньої якості, цього просто не буде чутно!",
    "date": "2025-09-26",
    "time": "26.09.2025 19:35:21 UTC+01:00"
  },
  {
    "text": "У прикладі, який ти навів раніше, добре видно, що навіть у найкращому випадку декодований файл все одно відрізнятиметься від оригіналу. PCM-дані у FLAC і WAV можуть бути біт-в-біт однакові, але звучання різниться через особливості декодування, буферизації, драйверів і цифрових ланцюгів відтворення.",
    "date": "2025-09-26",
    "time": "26.09.2025 20:01:14 UTC+01:00"
  },
  {
    "text": "А якщо 64 audio A18t та RME ADI-2 Pro FS R Black Edition треба чи не?",
    "date": "2025-09-26",
    "time": "26.09.2025 20:03:25 UTC+01:00"
  },
  {
    "text": "У гуру запитай він знає відповідь не слухавши!",
    "date": "2025-09-26",
    "time": "26.09.2025 20:14:58 UTC+01:00"
  },
  {
    "text": "З вухами народжуються, як їх можна обрати?",
    "date": "2025-09-26",
    "time": "26.09.2025 20:16:48 UTC+01:00"
  },
  {
    "text": "Нема, то я хочу фокал кліар або аудізі, або обидва варіанти",
    "date": "2025-09-26",
    "time": "26.09.2025 20:25:40 UTC+01:00"
  },
  {
    "text": "По перше це не персональний моніторінг, по друге це не твої гроші щоб рахувати!",
    "date": "2025-09-26",
    "time": "26.09.2025 20:32:08 UTC+01:00"
  },
  {
    "text": "Ти подивись спочатку сайт компанії, а ще прислухайся до консультації від виробника! Саме А18t аудіофільні навушники і виробник не рекомендує їх для персонального моніторінгу на сцені музикантам або інженерам 😉",
    "date": "2025-09-26",
    "time": "26.09.2025 21:14:13 UTC+01:00"
  },
  {
    "text": "Бо вони налаштовані під харман, а для сцени більше заходять інші частотні відгуки.",
    "date": "2025-09-26",
    "time": "26.09.2025 21:42:00 UTC+01:00"
  },
  {
    "text": "Це ж інша модель",
    "date": "2025-09-26",
    "time": "26.09.2025 22:08:10 UTC+01:00"
  },
  {
    "text": "Цікаво, \"різниця не сильна\" але так виходить що по звуку різниця більше ніж на графіках!",
    "date": "2025-09-26",
    "time": "26.09.2025 22:10:20 UTC+01:00"
  },
  {
    "text": "Цей провал більш схож на недолік вимірювання - коли відстань між випромінювачем та капсулем вимірювального  мікрофона співпадає у зону скасування цього діапазону.",
    "date": "2025-09-26",
    "time": "26.09.2025 22:18:26 UTC+01:00"
  },
  {
    "text": "Ага, що там по вимірюванням? Вже готові?!",
    "date": "2025-09-26",
    "time": "26.09.2025 22:23:40 UTC+01:00"
  },
  {
    "text": "Ну то передай бабусі що треба показати народу ту фантастичну інформацію!",
    "date": "2025-09-26",
    "time": "26.09.2025 22:33:22 UTC+01:00"
  },
  {
    "text": "https://www.threads.com/@gad1vq37vhr/post/DPKv3loAQV8?xmt=AQF0Kljt-NOuufBYXOyl8ulTkPtY0lXrwK6HFgHcGVWKWw&slof=1",
    "date": "2025-09-30",
    "time": "30.09.2025 01:04:53 UTC+01:00"
  },
  {
    "text": "Хотів сказати щось глибоке, але твоя поверхня не пропускає..",
    "date": "2025-09-30",
    "time": "30.09.2025 01:39:57 UTC+01:00"
  },
  {
    "text": "Чудова спроба, але бабуся вже плутає мікрофон з термометром і клянеться, що “фантастичні” коаксіали онука звучать краще за її радіолу 1973 року 📻А Dua Lipa тут, звісно, не випадково — це ж еталонний трек для святого порівняння динаміки та АЧХ, не інакше!",
    "date": "2025-09-30",
    "time": "30.09.2025 06:32:04 UTC+01:00"
  },
  {
    "text": "Ні, це  просто для тренувань та духовних практик, щоб чути деталі крізь пластмасу і біль!",
    "date": "2025-09-30",
    "time": "30.09.2025 08:17:40 UTC+01:00"
  },
  {
    "text": "Та мені таке взагалі не цікаво! От коли твоя бабуся перестане міряти температуру замість частот і таки знайде ті легендарні виміри онука Вови про коаксіальні системи, що “грають на 10 метрів” — от тоді, може, й буде про що говорити 😏 А про “референсні треки” — я щось не пам’ятаю, щоб ти мене про ...",
    "date": "2025-09-30",
    "time": "30.09.2025 17:05:32 UTC+01:00"
  },
  {
    "text": "Який ще крінж? Мені це просто не цікаво 😏 Я свої висновки зробив і з реальними фахівцями усе перевірив ще тоді, коли ти тільки вчився знаходити, де в комп’ютері той “Озон” відкривається. Тому твої порівняння для мене як прогнози синоптика на Марсі — цікаві лише теоретично. Але якщо раптом знайдеш...",
    "date": "2025-09-30",
    "time": "30.09.2025 17:26:49 UTC+01:00"
  },
  {
    "text": "Я ж питав про ті легендарні виміри “фантастичних” коаксіалів і чарівного вікна затримки, про які ти ще давно накатав епічного крінжу 😏 Але, схоже, або пам’ять підвела, або це така стратегія — перевести увагу й зробити вигляд, що нічого не було.",
    "date": "2025-09-30",
    "time": "30.09.2025 17:34:57 UTC+01:00"
  },
  {
    "text": "Та хто б сумнівався 😏 Про коаксіали — “інша тема”, її ж ми обов’язково розберемо… от як тільки зірки стануть у ряд і Всесвіт благословить на це день! Моє питання про ті легендарні фантастичні коаксіали висить уже майже пів року, але час у тебе стабільно є лише на підколки. А от на те, щоб бодай р...",
    "date": "2025-09-30",
    "time": "30.09.2025 18:10:27 UTC+01:00"
  },
  {
    "text": "Та я ж і не скаржуся, що часу нема — хоча зобов’язань і турбот у мене не менше, ніж у тебе 😏 Просто різниця в тому, що я не прикриваю ними кожну відмовку!",
    "date": "2025-09-30",
    "time": "30.09.2025 18:27:44 UTC+01:00"
  },
  {
    "text": "Це фантастично! 🥰",
    "date": "2025-09-30",
    "time": "30.09.2025 18:31:56 UTC+01:00"
  },
  {
    "text": "Я ж вже сказав що мені ті порівняння не цікаві!А якщо б були цікаві, то зараз нема великої та якісної системи щоб зробити порівняння та прослуховування!",
    "date": "2025-09-30",
    "time": "30.09.2025 18:53:04 UTC+01:00"
  },
  {
    "text": "Я ж тебе не просив форматами жонглювати й порівняння робити!А от про вимірювання тих легендарних “фантастичних” коаксіалів і чарівного вікна затримки — це ж ти сам обіцяв. То як це тепер розуміти? Новий стиль ховання власного крінжу — перевести увагу на щось інше?",
    "date": "2025-09-30",
    "time": "30.09.2025 19:17:43 UTC+01:00"
  },
  {
    "text": "Так, згоден: якщо при інверсії полярності дві доріжки складаються в тишу — значить, вони біт-у-біт однакові.Я ж і не про “різницю файлів” говорив, а про різницю у тестах прослуховування чи порівняння, яка може з’являтися через тракт: плеєр здатен по-різному поводитися з WAV і FLAC — підхопити Rep...",
    "date": "2025-09-30",
    "time": "30.09.2025 21:17:39 UTC+01:00"
  },
  {
    "text": "Я все ж почекаю, коли настане той історичний момент, коли ти нарешті зробиш виміри своїх легендарних “фантастичних” коаксіалів, що грають на 10 метрів — бо ж без них аудіосвіт, очевидно, приречений блукати в темряві 😏",
    "date": "2025-09-30",
    "time": "30.09.2025 22:37:38 UTC+01:00"
  },
  {
    "text": "Може ти вже заспокоїшся?",
    "date": "2025-10-08",
    "time": "08.10.2025 16:51:29 UTC+01:00"
  },
  {
    "text": "Не можу за когось казати, мене вже подкумарело, нашо  цей спам?",
    "date": "2025-10-08",
    "time": "08.10.2025 16:54:10 UTC+01:00"
  },
  {
    "text": "Нам це кому? , ти наче нічого не пишеш?",
    "date": "2025-10-08",
    "time": "08.10.2025 16:58:43 UTC+01:00"
  },
  {
    "text": "Ти хочеш про це поговорити?",
    "date": "2025-10-08",
    "time": "08.10.2025 17:02:28 UTC+01:00"
  },
  {
    "text": "Звичайно є, і наче ми навіть домовились про це з тобою, а ти зразу в втік і я тебе вже більше місяця не бачу",
    "date": "2025-10-08",
    "time": "08.10.2025 17:05:46 UTC+01:00"
  },
  {
    "text": "Сюрприз)))",
    "date": "2025-10-08",
    "time": "08.10.2025 17:10:23 UTC+01:00"
  },
  {
    "text": "1000 грн за мр3 320А тобі вистачить якості мр3 щоб віддати замовнику?",
    "date": "2025-10-08",
    "time": "08.10.2025 17:24:24 UTC+01:00"
  },
  {
    "text": "Там у технічних умовах лише мр3 що і є уже міксом 😁",
    "date": "2025-10-08",
    "time": "08.10.2025 17:26:18 UTC+01:00"
  },
  {
    "text": "Я готовий передати мікс - ось мр3 як і написано у технічних умовах 😁",
    "date": "2025-10-08",
    "time": "08.10.2025 17:27:02 UTC+01:00"
  },
  {
    "text": "Та качай вже мр3 та роби той мікс",
    "date": "2025-10-08",
    "time": "08.10.2025 17:29:29 UTC+01:00"
  },
  {
    "text": "Кидаєш мікс на зведення у групу за 1000 грн, береш з замовника $400 😉",
    "date": "2025-10-08",
    "time": "08.10.2025 17:31:06 UTC+01:00"
  },
  {
    "text": "Особисті відносини з замовником це не професійно!",
    "date": "2025-10-08",
    "time": "08.10.2025 17:32:36 UTC+01:00"
  },
  {
    "text": "Скидай їй ту демку і кажи що то переможець, ще й гроші собі забереш! Або залишаться у родині",
    "date": "2025-10-08",
    "time": "08.10.2025 17:39:25 UTC+01:00"
  },
  {
    "text": "За 50% відсотків можна зробити три варіанти і залишити 50% від банку конкурсу у родині!",
    "date": "2025-10-08",
    "time": "08.10.2025 17:41:05 UTC+01:00"
  },
  {
    "text": "Щоб награли все наново 😁",
    "date": "2025-10-08",
    "time": "08.10.2025 17:42:26 UTC+01:00"
  },
  {
    "text": "Так і буде!",
    "date": "2025-10-08",
    "time": "08.10.2025 17:47:53 UTC+01:00"
  },
  {
    "text": "Обережно, це моя територія! 😉",
    "date": "2025-10-11",
    "time": "11.10.2025 03:16:35 UTC+01:00"
  },
  {
    "text": "@KostyantinZvukде твої золоті кабелі?",
    "date": "2025-10-11",
    "time": "11.10.2025 16:43:42 UTC+01:00"
  },
  {
    "text": "Ща тобі розкажуть у яких областях України які плагіни краще використовувати !",
    "date": "2025-10-11",
    "time": "11.10.2025 16:59:23 UTC+01:00"
  },
  {
    "text": "Досвіду з плагінами в мене небагато, але навіть без нього неважко помітити, що Waves — це такий собі Hi-Fi із базару: ніби працює, але краще не вдивлятися.",
    "date": "2025-10-11",
    "time": "11.10.2025 17:14:06 UTC+01:00"
  },
  {
    "text": "Чому тоді Кріс на приватних сесіях коли показує як він зводе у коробці то використовує інші плагіни і лише декілька вейвс -версії саме його 1176 ?У всіх є добрі інструменти, але суть інша - якість звуку вейвс, так мильні але є декілька в них зручних інструментів.",
    "date": "2025-10-11",
    "time": "11.10.2025 17:32:03 UTC+01:00"
  },
  {
    "text": "Обережно! Тут є декілька особистостей в яких може бути різке підвищення рівня ванільності! ⚠️",
    "date": "2025-10-11",
    "time": "11.10.2025 17:40:25 UTC+01:00"
  },
  {
    "text": "Дякую, кеп! Завжди приємно дізнаватись очевидне з першоджерела!",
    "date": "2025-10-11",
    "time": "11.10.2025 17:58:18 UTC+01:00"
  },
  {
    "text": "Новий конкурс! 😉",
    "date": "2025-10-11",
    "time": "11.10.2025 17:58:51 UTC+01:00"
  },
  {
    "text": "Я ж глухий не чую на два ока 👀",
    "date": "2025-10-11",
    "time": "11.10.2025 17:59:43 UTC+01:00"
  },
  {
    "text": "Вові не показуй, бо він невгамовний буде задовбувати ту програму поки вона не видасть йому найкращі результати!",
    "date": "2025-10-11",
    "time": "11.10.2025 18:08:09 UTC+01:00"
  },
  {
    "text": "Треба терміново плагін для туби і бібліотеку для Роланд акордеона бо без зовнішньої бібліотеки не звучить!Що порекомендуєте?!",
    "date": "2025-10-11",
    "time": "11.10.2025 21:23:56 UTC+01:00"
  },
  {
    "text": "А для туби що б порекомендували, може акваріум як на барабанах?!",
    "date": "2025-10-11",
    "time": "11.10.2025 22:19:28 UTC+01:00"
  },
  {
    "text": "Там у реку внизу дві коробочки цікаві, спеціально щоб не використовувати вейвс 😁",
    "date": "2025-10-11",
    "time": "11.10.2025 22:29:39 UTC+01:00"
  },
  {
    "text": "Дякую, кеп, що невтомно просвітлюєш нас у сфері очевидних істин про життя, запис і мікшування — справжнє світло в темряві наших банальностей.",
    "date": "2025-10-11",
    "time": "11.10.2025 22:48:12 UTC+01:00"
  },
  {
    "text": "Я не один — ми тихо множимось у тіні здорового глузду! 😉",
    "date": "2025-10-11",
    "time": "11.10.2025 23:03:47 UTC+01:00"
  },
  {
    "text": "Краще темрява Готема, ніж сяючий ванільний балаган від Marvel.",
    "date": "2025-10-11",
    "time": "11.10.2025 23:10:38 UTC+01:00"
  },
  {
    "text": "Кожен обирає в межах своїх можливостей і фантазійних відхилень!",
    "date": "2025-10-11",
    "time": "11.10.2025 23:19:50 UTC+01:00"
  },
  {
    "text": "Я все ж таки почекаю на ті фантастичні коаксиали!",
    "date": "2025-10-12",
    "time": "12.10.2025 00:15:26 UTC+01:00"
  },
  {
    "text": "Я взагалі дуже полюбляю коаксіали — тому мені й особливо цікаві ті легендарні кастом-коаксіали, що грають на 10 метрів!Тож із нетерпінням чекаю на це акустичне диво! 😍",
    "date": "2025-10-12",
    "time": "12.10.2025 00:42:19 UTC+01:00"
  },
  {
    "text": "Я вже по картинці бачу що малий барабан не має атаки! 😁",
    "date": "2025-10-12",
    "time": "12.10.2025 01:54:19 UTC+01:00"
  },
  {
    "text": "В мене зір уже не той, що колись — бо якось не читається, хоч трісни!",
    "date": "2025-10-12",
    "time": "12.10.2025 02:14:33 UTC+01:00"
  },
  {
    "text": "Скоріше за все то було за то як в моєї мавпи 🙈",
    "date": "2025-10-12",
    "time": "12.10.2025 06:38:17 UTC+01:00"
  },
  {
    "text": "Ну то точно не ти був, що казав що треба зробити як профі Кріс Лорд з гімна конхвету…",
    "date": "2025-10-12",
    "time": "12.10.2025 07:14:16 UTC+01:00"
  },
  {
    "text": "Як це не можемо зібратись? Ми вже в двох чатах одночасно!А Вова взагалі проводить міжчатові тести — справжній піонер!",
    "date": "2025-10-12",
    "time": "12.10.2025 07:55:05 UTC+01:00"
  },
  {
    "text": "О, ну це справді досягнення! 😏А кого ж тоді він таки “переконав”?",
    "date": "2025-10-12",
    "time": "12.10.2025 08:09:22 UTC+01:00"
  },
  {
    "text": "О, ну так, тут усі горді за свої мікси - скромність у дефіциті!У Діми багато референсів є з етерів, треба було лише запитати!Я доречі питав тебе за малий барабан, чи ти можеш навести приклад де записано гарно та навести приклад з аудіо?",
    "date": "2025-10-12",
    "time": "12.10.2025 08:25:16 UTC+01:00"
  },
  {
    "text": "Я знаю лише одне - байдужість рідко вимагає кілька днів презентацій про власний професіоналізм і незацікавленість!",
    "date": "2025-10-12",
    "time": "12.10.2025 08:33:20 UTC+01:00"
  },
  {
    "text": "Так, про мій досвід розповідаю не лише я в чатах і на ютубах теж вистачає розмов!",
    "date": "2025-10-12",
    "time": "12.10.2025 08:41:56 UTC+01:00"
  },
  {
    "text": "Так, я дуже заздрю Вові бо в нього є кастом коаксиали які грають на 10 метрів! Я такі теж хочу, але так трапилось що доки таке можливо тільки у Чернівцях!",
    "date": "2025-10-12",
    "time": "12.10.2025 08:44:55 UTC+01:00"
  },
  {
    "text": "Ти про цей?https://www.youtube.com/live/LnWh4NUFCjM?si=xBBuenq29ypF888O",
    "date": "2025-10-12",
    "time": "12.10.2025 08:49:33 UTC+01:00"
  },
  {
    "text": "Ну так \"звучить\", але якість звуку насправді така собі - хай фай з привозу…",
    "date": "2025-10-12",
    "time": "12.10.2025 08:52:23 UTC+01:00"
  },
  {
    "text": "Ну подивись ще раз, там багато інформації. Я потім ще скину )Може з роками щось і від тебе дізнаємось по темі аудіо.",
    "date": "2025-10-12",
    "time": "12.10.2025 08:54:32 UTC+01:00"
  },
  {
    "text": "А їх нема, то ж баптисти 😆",
    "date": "2025-10-12",
    "time": "12.10.2025 08:55:08 UTC+01:00"
  },
  {
    "text": "Є ще одне нове про налаштування акустичних систем але там таке мені не дуже подобається як вийшло і дуже старе про Х32!Подивись може візьмеш щось для себе крім налаштування anydesk та роботу у daw, бо ти вже дивися то у Вови!",
    "date": "2025-10-12",
    "time": "12.10.2025 09:14:33 UTC+01:00"
  },
  {
    "text": "Так було ж у чаті, подивись канал на ютубері - хай так воршіп!",
    "date": "2025-10-12",
    "time": "12.10.2025 09:37:14 UTC+01:00"
  },
  {
    "text": "Я таке, знаю! Буває ще і не таке сьогодні знайомий що працює на студіях як інженер розповів як один з продюсерів взагалі наполягав записати кожен барабан окремо  і записав 😁",
    "date": "2025-10-12",
    "time": "12.10.2025 09:50:37 UTC+01:00"
  },
  {
    "text": "Ніт, саме пісню, доволі відомої групи! Потрібен був саме такий саунд )",
    "date": "2025-10-12",
    "time": "12.10.2025 09:53:41 UTC+01:00"
  },
  {
    "text": "Цікаво, я просто попросив навести приклад, бажано з аудіо, щоб зрозуміти як може  бути!А вийшло що я винен у маніпуляціях та викручування  фактів! 😁То в тебе все нормально зі здоровим спілкуванням?",
    "date": "2025-10-12",
    "time": "12.10.2025 15:53:46 UTC+01:00"
  },
  {
    "text": "Там є ще декілька повідомлень, саме до тебе, яки ти проігнорував, де я просив скинути приклади.Але ж тобі треба причепитись саме до цього )))",
    "date": "2025-10-12",
    "time": "12.10.2025 15:58:22 UTC+01:00"
  },
  {
    "text": "Це все дуже цікаво, але що там з прикладом малого барабану?Ти наведеш приклад чи ні?",
    "date": "2025-10-12",
    "time": "12.10.2025 16:04:56 UTC+01:00"
  },
  {
    "text": "Нічого не бачу, сліпий )",
    "date": "2025-10-12",
    "time": "12.10.2025 16:06:02 UTC+01:00"
  },
  {
    "text": "Я тебе просто запитав, а після твого ігнору попросив запитати Диму!Але треба ж зробити перфоманс - маніпуляція, викривлення фактів…Я тебе просто попросив надати приклад як записати малий барабан з меншим хай хетом - все! Не можеш або не хочеш - так і скажи 😁",
    "date": "2025-10-12",
    "time": "12.10.2025 16:08:49 UTC+01:00"
  },
  {
    "text": "Я декілька разів попросив ще до того скріна який ти навів!Знов температура чи що?! 😁",
    "date": "2025-10-12",
    "time": "12.10.2025 16:13:52 UTC+01:00"
  },
  {
    "text": "Знайди будь ласка, бо я не бачив ті відповіді!",
    "date": "2025-10-12",
    "time": "12.10.2025 16:15:25 UTC+01:00"
  },
  {
    "text": "Це було вже після того як я декілька разів запитав за приклад!Ти вимірювальний мікрофон з градусником не переплутав?!",
    "date": "2025-10-12",
    "time": "12.10.2025 16:21:41 UTC+01:00"
  },
  {
    "text": "Я іноді ще сплю у ночі, це був саме той випадок!",
    "date": "2025-10-12",
    "time": "12.10.2025 16:23:48 UTC+01:00"
  },
  {
    "text": "Дякую кеп, це вже було..",
    "date": "2025-10-12",
    "time": "12.10.2025 16:24:17 UTC+01:00"
  },
  {
    "text": "Так і що ти знайдеш ту відповідь чи тапки вже готовиш?",
    "date": "2025-10-12",
    "time": "12.10.2025 16:27:48 UTC+01:00"
  },
  {
    "text": "Та я знаю що тупий, живу у ЛА спілкуюсь з різними інженерами зі студій і не знаю як той малий барабан записати щоб було менше хай хету у його мікрофоні!",
    "date": "2025-10-12",
    "time": "12.10.2025 16:34:54 UTC+01:00"
  },
  {
    "text": "Та все питання було ж саме за хай хет у мікрофоні малого барабану… піди візьми тапки у Вови, це вже не цікаво (",
    "date": "2025-10-12",
    "time": "12.10.2025 16:37:51 UTC+01:00"
  },
  {
    "text": "То що там знайдеш скрін чи 👣👣👣 ?",
    "date": "2025-10-12",
    "time": "12.10.2025 16:41:21 UTC+01:00"
  },
  {
    "text": "Який попросив знайти, будь ласка 🙏🏿",
    "date": "2025-10-12",
    "time": "12.10.2025 16:44:22 UTC+01:00"
  },
  {
    "text": "Так ця відповідь була після моїх повідомлень. А ти ж до моїх просьб причепився, то ж будь ласка відповідай 😁",
    "date": "2025-10-12",
    "time": "12.10.2025 16:53:31 UTC+01:00"
  },
  {
    "text": "Просто взяв собі, в нас же спілкування саме за те що на запису конкурса багато хай хету у мікрофоні малого барабану!То ми обговорюємо як можна зробити менше!",
    "date": "2025-10-12",
    "time": "12.10.2025 17:05:14 UTC+01:00"
  },
  {
    "text": "Ще ні, я його особисто не знаю! Але чекаю коли мій добрий знайомий який його знає приїде до ЛА та є можливість до нього потрапити.",
    "date": "2025-10-12",
    "time": "12.10.2025 17:08:24 UTC+01:00"
  },
  {
    "text": "Дійсно є чим пишатися, погралися у \"патріотів\"!",
    "date": "2025-10-12",
    "time": "12.10.2025 17:10:42 UTC+01:00"
  },
  {
    "text": "Знов підвищення температури? Чи ти не збивав її?",
    "date": "2025-10-12",
    "time": "12.10.2025 17:11:54 UTC+01:00"
  },
  {
    "text": "Тільки на вимірах!",
    "date": "2025-10-12",
    "time": "12.10.2025 17:13:14 UTC+01:00"
  },
  {
    "text": "У Мартіна Сміта було Audix D6 на всіх томах, аж два тома 😂 + роланд тригери для гейтів.",
    "date": "2025-10-12",
    "time": "12.10.2025 23:08:02 UTC+01:00"
  },
  {
    "text": "А яки в них ціни на зведення хочаб приблизно?",
    "date": "2025-11-07",
    "time": "07.11.2025 19:20:43 UTC+01:00"
  },
  {
    "text": "Все дуже залежить від клієнта, звичайно від 800-2000 за мікс.І прайс підіймається якщо в тебе багато клієнтів, щоб зменшити навантаження.Ну і плюс що за робота - мікс один раз або цілий проєкт…",
    "date": "2025-11-07",
    "time": "07.11.2025 21:26:47 UTC+01:00"
  },
  {
    "text": "Так і що делать если уже есть?! Нові плагини випускают?! 😁",
    "date": "2025-12-08",
    "time": "08.12.2025 08:36:29 UTC+01:00"
  },
  {
    "text": "Бери 440, класний мікрофон - справжній топчик за свої гроші!se це капелюх 🎩",
    "date": "2025-12-08",
    "time": "08.12.2025 16:11:48 UTC+01:00"
  },
  {
    "text": "Як мінімум lewitt проживе у рази довше ніж se 😉На моєму часі саме ця модель se декілька разів виходила з ладу, ну і звук чесно кажучи в нього такий сами як і ціна - дешевий…",
    "date": "2025-12-08",
    "time": "08.12.2025 16:20:23 UTC+01:00"
  },
  {
    "text": "Краще взагалі нічого не писати про прокати з західної, бо то прокати - журба! 😭",
    "date": "2025-12-08",
    "time": "08.12.2025 17:30:58 UTC+01:00"
  },
  {
    "text": "Це я закриваю НК та без обмежень в ЛА - всіх разом в два канали втиснули!",
    "date": "2025-12-08",
    "time": "08.12.2025 17:39:35 UTC+01:00"
  },
  {
    "text": "Цікава логіка - в райдері лякустик то значить хлопці так добре працюють що не можуть бути журбою прокатом ніяк 😭Он Вова \"голова дубова\" з Харкова має лякустік, пельмені, пульти різні та мікрофони нормальні але як був журбою прокатом…",
    "date": "2025-12-08",
    "time": "08.12.2025 17:43:22 UTC+01:00"
  },
  {
    "text": "Може і знаю, в мене погано з імʼям",
    "date": "2025-12-08",
    "time": "08.12.2025 17:45:59 UTC+01:00"
  },
  {
    "text": "Тупо їздять по всій Україні та закривають купу концертів! Реально профіки!",
    "date": "2025-12-08",
    "time": "08.12.2025 18:20:22 UTC+01:00"
  },
  {
    "text": "Та ти і півгодини не витримаєш 🤣😭",
    "date": "2025-12-08",
    "time": "08.12.2025 23:03:44 UTC+01:00"
  },
  {
    "text": "Просто відрийте продукт від apple, та подивитись як зроблена внутрішня інженерія! А потім поговоримо про що і скільки повинно коштувати )Зрозуміло що комусь і не потрібна вся та інженерія та зручніше таскати громіздкий девайс за значно менші гроші 🫰Тому кожному своє )",
    "date": "2025-12-14",
    "time": "14.12.2025 19:30:50 UTC+01:00"
  },
  {
    "text": "А хто хоче тест/порівняння якості звуку?!",
    "date": "2025-12-17",
    "time": "17.12.2025 08:36:27 UTC+01:00"
  },
  {
    "text": "Наприклад Х32 який по графіках АЧХ відрізняється на 1.5 дБ від еталону.",
    "date": "2025-12-17",
    "time": "17.12.2025 08:38:19 UTC+01:00"
  },
  {
    "text": "може нам не треба до них наближатись )",
    "date": "2025-12-17",
    "time": "17.12.2025 08:41:37 UTC+01:00"
  },
  {
    "text": "мені якось скинули як ті \"фірмачі\" з бефел налаштували РА систему від Майер Саунд за всі гроши - то журба!",
    "date": "2025-12-17",
    "time": "17.12.2025 08:44:08 UTC+01:00"
  },
  {
    "text": "Мене просто запитали що може бути - наче відомий виробник та виглядає все норм, налаштовували \"фірмачі\" з бефел, але звучить сумнівно наче щось не так ))Я спитав чи можна відкрити подивитись гелаксі - і то був джек пот/скриня пандори 😭🤣",
    "date": "2025-12-17",
    "time": "17.12.2025 08:58:03 UTC+01:00"
  },
  {
    "text": "До тебе їм ще далеко, навіть вони не можуть змусити коаксіали повноцінно грати далі 4-6 метрів!",
    "date": "2025-12-17",
    "time": "17.12.2025 09:03:54 UTC+01:00"
  },
  {
    "text": "Цікаво як то можливо навіти не одночасно використовувати для комерції один айлок акаунт на 100 людей, або навіть 4-6?! 😁",
    "date": "2025-12-17",
    "time": "17.12.2025 09:34:13 UTC+01:00"
  },
  {
    "text": "REW кому цікаво",
    "date": "2025-12-17",
    "time": "17.12.2025 09:37:19 UTC+01:00"
  },
  {
    "text": "Технічно я розумію як, моє питання як працювати різним людям таким способом?!",
    "date": "2025-12-17",
    "time": "17.12.2025 09:40:39 UTC+01:00"
  },
  {
    "text": "один зфайлів треба зробити тихіше на 1 дБ )",
    "date": "2025-12-17",
    "time": "17.12.2025 09:43:04 UTC+01:00"
  },
  {
    "text": "Це технічно зрозуміло, мені не зрозуміло як декілька людей можуть вести бізнес використовуючи один аккаунт де у більшості тільки одна чи максимум дві активації… це ж печаль!",
    "date": "2025-12-17",
    "time": "17.12.2025 09:47:45 UTC+01:00"
  },
  {
    "text": "У самого Стівена Слейт залишився тільки тригер та барабани. Інші плагіни то тепер зовсім інша контора яка теж називається Слейт, але Слейт діджитал і вона в брітосіі",
    "date": "2025-12-17",
    "time": "17.12.2025 14:55:08 UTC+01:00"
  },
  {
    "text": "Це теж плагіни?!",
    "date": "2025-12-17",
    "time": "17.12.2025 15:02:07 UTC+01:00"
  },
  {
    "text": "Так в нас мова за плагіни була, до чого контролер та навушники?",
    "date": "2025-12-17",
    "time": "17.12.2025 15:28:44 UTC+01:00"
  },
  {
    "text": "Так є великі профі насводили редактори- вони можуть скорегувати час та виконання! 😉",
    "date": "2025-12-17",
    "time": "17.12.2025 15:30:59 UTC+01:00"
  },
  {
    "text": "Не відпускає, чи що?!",
    "date": "2025-12-17",
    "time": "17.12.2025 15:32:04 UTC+01:00"
  },
  {
    "text": "По суті в нас з Володимиром була дискусія з використання плагінів з одного акаунта двома різним людинами!Може одні навушники теж можна поділити на два…Достатньо по суті?! Йди гуляйся хлопчик, дай двом дорослим поговорити!",
    "date": "2025-12-17",
    "time": "17.12.2025 15:49:01 UTC+01:00"
  },
  {
    "text": "Так теж саме РМЕ звучить всюди, просто в одному випадку додано покращувач ❌ 32 )",
    "date": "2025-12-17",
    "time": "17.12.2025 18:02:09 UTC+01:00"
  },
  {
    "text": "Цікаво, це ти сам собі придумав що я не працюю на такому обладнані в силу обставин?",
    "date": "2025-12-17",
    "time": "17.12.2025 18:12:34 UTC+01:00"
  },
  {
    "text": "Я доволі часто працю на різних консолях і все ще буває часто Х/М32.Але мені подобається як хтось щось мені порівнює та робе висновки, коли взагалі нуль знає про мене та мій досвід 😁",
    "date": "2025-12-17",
    "time": "17.12.2025 19:20:26 UTC+01:00"
  },
  {
    "text": "Дякую за пораду, вона нікому не потрібна, але дякую!",
    "date": "2025-12-17",
    "time": "17.12.2025 19:40:18 UTC+01:00"
  },
  {
    "text": "Я краще тобі нагадаю щось інше! Бо ти вже забув!",
    "date": "2025-12-17",
    "time": "17.12.2025 19:42:39 UTC+01:00"
  },
  {
    "text": "Треба підтримувати, бо нема кому буде жалітись та обижатися!@olderstБагато хто мікс можуть зробити не гірше ніж ти, а може і краще!",
    "date": "2025-12-17",
    "time": "17.12.2025 19:45:33 UTC+01:00"
  },
  {
    "text": "А ще краще на winamp через телеграм )",
    "date": "2025-12-17",
    "time": "17.12.2025 21:09:14 UTC+01:00"
  },
  {
    "text": "Емуляція сатураторів за допомогою преампів Х32",
    "date": "2025-12-17",
    "time": "17.12.2025 21:58:22 UTC+01:00"
  },
  {
    "text": "Если не ошибаюсь, плагин доктор может анализировать внешние приборы",
    "date": "2025-12-17",
    "time": "17.12.2025 22:41:35 UTC+01:00"
  },
  {
    "text": "Иногда бывает😁",
    "date": "2025-12-17",
    "time": "17.12.2025 22:46:46 UTC+01:00"
  },
  {
    "text": "Це навіть не смішно, це крінж - коли ти сам не прочитав що написано під фото, тупо перепостив і додав ще про Макса і Диму!Я навіть не знаю, це просто бідося - стільки розповідати про повагу/не повагу, високі цінності і навалити такого.Гарний приклад брате, дякую!",
    "date": "2025-12-19",
    "time": "19.12.2025 00:48:19 UTC+01:00"
  },
  {
    "text": "@dima_opalkohttps://www.instagram.com/reel/DSXi4Hfilaa/?igsh=NTc4MTIwNjQ2YQ==Що делать, если в аквариум посадить все равно барики в микрофон будут лезть 😂",
    "date": "2025-12-19",
    "time": "19.12.2025 03:34:03 UTC+01:00"
  },
  {
    "text": "@dima_opalkohttps://www.instagram.com/reel/DMksOiCOHHf/?igsh=NTc4MTIwNjQ2YQ==Де кабина?",
    "date": "2025-12-19",
    "time": "19.12.2025 05:05:57 UTC+01:00"
  },
  {
    "text": "Малий барабан як треба )))А не все то ССМ",
    "date": "2025-12-19",
    "time": "19.12.2025 05:23:43 UTC+01:00"
  },
  {
    "text": "Спершу доведеться відправити пошукову експедицію, а потім ще кілька науково-дослідних - раптом десь між рядками знайдуть гумор у твоїх повідомленнях.А якщо знайдеться, доведеться шукати грант на вирощування в лабораторних умовах, бо сам він навряд чи зможе розвинутись! 😁",
    "date": "2025-12-19",
    "time": "19.12.2025 16:58:06 UTC+01:00"
  },
  {
    "text": "Так вже склалося, що одеситам не треба захищати роботи з гуморознавства й ганятися за науковими ступенями.А якщо мій жарт не заходить- то, можливо, справа не в жарті, а в явному дефіциті самоіронії.Тож якщо буде бажання попрацювати над цим- матеріалу в двох чатах більш ніж достатньо.",
    "date": "2025-12-19",
    "time": "19.12.2025 17:33:52 UTC+01:00"
  },
  {
    "text": "Для прокачки самоіронії - чату вистачить!",
    "date": "2025-12-19",
    "time": "19.12.2025 19:00:38 UTC+01:00"
  },
  {
    "text": "Там трохи є пояснення, якщо уважно читати то можна знайти відповідь.",
    "date": "2025-12-19",
    "time": "19.12.2025 19:17:16 UTC+01:00"
  },
  {
    "text": "Дитячий садок, мені нравится сматрєть!",
    "date": "2025-12-19",
    "time": "19.12.2025 19:29:41 UTC+01:00"
  },
  {
    "text": "Страшні в тебе висновки, сам собі щось придумав і видаєш це за дійсність 😂",
    "date": "2025-12-19",
    "time": "19.12.2025 19:31:59 UTC+01:00"
  },
  {
    "text": "Самоіронія це також коли ти  можеш сміятися з жарту над тобою.",
    "date": "2025-12-19",
    "time": "19.12.2025 19:35:18 UTC+01:00"
  },
  {
    "text": "В мене нема книжки з пунктами, це ти переплутав щось!",
    "date": "2025-12-19",
    "time": "19.12.2025 19:37:11 UTC+01:00"
  },
  {
    "text": "Уважніше треба було дивитись!",
    "date": "2025-12-19",
    "time": "19.12.2025 19:39:05 UTC+01:00"
  },
  {
    "text": "Срач від вінга не може бути цікавим апріорі…",
    "date": "2025-12-19",
    "time": "19.12.2025 19:43:08 UTC+01:00"
  },
  {
    "text": "Краще вже крізь ссл!",
    "date": "2025-12-19",
    "time": "19.12.2025 19:45:22 UTC+01:00"
  },
  {
    "text": "Та ні, просто не хотів, щоб після мого результату вам довелося міняти не самооцінку, а реальність 😂",
    "date": "2025-12-19",
    "time": "19.12.2025 19:50:21 UTC+01:00"
  },
  {
    "text": "Буде трохи краще ніж в церкві ред рокс! Це ж вінг!",
    "date": "2025-12-19",
    "time": "19.12.2025 19:51:32 UTC+01:00"
  },
  {
    "text": "Треба щоб як в потужних церквах було, що там рек без кнопкав?!",
    "date": "2025-12-19",
    "time": "19.12.2025 19:55:43 UTC+01:00"
  },
  {
    "text": "Саме так -у тій реальності, де менша цифра краща, вам якраз там буде комфортніше!",
    "date": "2025-12-19",
    "time": "19.12.2025 19:59:43 UTC+01:00"
  },
  {
    "text": "Коли я проходив тест то вже на першому етапи закінчилась шкала…",
    "date": "2025-12-19",
    "time": "19.12.2025 20:01:18 UTC+01:00"
  },
  {
    "text": "Це вже до свого лікаря звертатись треба, він тобі може виписати рецепт на реальність!",
    "date": "2025-12-19",
    "time": "19.12.2025 20:02:51 UTC+01:00"
  },
  {
    "text": "Дійсно страшно, що б було далі - скинув би у чат свій високий результат?! 😁",
    "date": "2025-12-19",
    "time": "19.12.2025 20:10:02 UTC+01:00"
  },
  {
    "text": "Дякую, мені не треба!",
    "date": "2025-12-19",
    "time": "19.12.2025 20:14:48 UTC+01:00"
  },
  {
    "text": "Справді не треба, вже і так вистачає того високого результату що вже є клубі! 😉",
    "date": "2025-12-19",
    "time": "19.12.2025 20:22:11 UTC+01:00"
  },
  {
    "text": "Ну так все ще попереду, є над чим працювати! Не зупиняйся, ми в тебе віримо!",
    "date": "2025-12-19",
    "time": "19.12.2025 20:31:33 UTC+01:00"
  },
  {
    "text": "Тільки ментально вплинуло )",
    "date": "2025-12-19",
    "time": "19.12.2025 20:47:59 UTC+01:00"
  },
  {
    "text": "Так, а як вгадати де який, якщо мав справу з одним двома мікрофонами, а інші бюджетні тільки на картинках в реал мьюзік бачив?!І якщо це декілька різних записів на кожен мік, а не одночасно один запис на різні мікрофони то в чому саме сенс порівняння?",
    "date": "2025-12-22",
    "time": "22.12.2025 02:33:02 UTC+01:00"
  },
  {
    "text": "Так а смІсл?!",
    "date": "2025-12-22",
    "time": "22.12.2025 06:04:13 UTC+01:00"
  },
  {
    "text": "Теж досвід",
    "date": "2025-12-22",
    "time": "22.12.2025 06:12:27 UTC+01:00"
  },
  {
    "text": "Цікава інформація ℹ️Але це більше для Чернівці підійде 😆",
    "date": "2025-12-22",
    "time": "22.12.2025 08:53:05 UTC+01:00"
  },
  {
    "text": "То ж всеодно треба слухати як воно буде у контексті у міксі )",
    "date": "2025-12-22",
    "time": "22.12.2025 09:35:35 UTC+01:00"
  },
  {
    "text": "Цікава у вас тут історія склалась- самі собі щось вигадали, самі розвинули, а потім героїчно видали це за мою позицію.Я говорив про контекст міксу, а не про те, що “дешеве краще за дороге” і тим більше не про казки рівня DiGiCo vs Behringer.Але фантазія у вас працює добре -шкода, що не завжди раз...",
    "date": "2025-12-22",
    "time": "22.12.2025 17:31:30 UTC+01:00"
  },
  {
    "text": "Просто у порівнянні  як саме мікрофони тримають частотний баланс коли ти змінюєш відстань -уже всьо панятна!Звичайно хотілось би ще тест як вони витримують та передають динаміку вокалу чи барабанів.Ю87 дуже універсальний мікрофон, але по вокалу як на мене більше підходить до жіночих голосів.",
    "date": "2025-12-22",
    "time": "22.12.2025 17:51:03 UTC+01:00"
  },
  {
    "text": "В мене максимум онлайн класи 🤣😆",
    "date": "2025-12-22",
    "time": "22.12.2025 17:59:37 UTC+01:00"
  },
  {
    "text": "Оверхед, кімната, струнні, піано… взагалі як інструментальний мікрофон то взагалі універсальний )",
    "date": "2025-12-22",
    "time": "22.12.2025 18:11:20 UTC+01:00"
  },
  {
    "text": "Як там твої мікси де рух фейдера у 1-.15 дБ змінює всьо- зможуть зрозуміти динаміку, чи дядя Вова закрутив їм гайки?",
    "date": "2025-12-22",
    "time": "22.12.2025 18:24:04 UTC+01:00"
  },
  {
    "text": "Ти забув додати що неодноразовий переможець конкурсу насводил! 😉",
    "date": "2025-12-22",
    "time": "22.12.2025 18:42:25 UTC+01:00"
  },
  {
    "text": "Треба його послухати на вокалі з контекстом, можна навіть з ю87 порівняти.Два мікрофона ще якось можна один до одного поставити щоб записати одночасно один вокал.А так що сказати, мікрофон і мікрофон, якщо для тебе працює - супер!",
    "date": "2025-12-22",
    "time": "22.12.2025 19:15:25 UTC+01:00"
  },
  {
    "text": "Але є ті хто теж робить не дуже, а їм подобається )",
    "date": "2025-12-22",
    "time": "22.12.2025 19:27:12 UTC+01:00"
  },
  {
    "text": "А тут більш нема тем крім вінга що класно звучить, моно- стерео, хто скільки раз вийграв місцевий конкурс, яку різницю чує та який айкю.",
    "date": "2025-12-22",
    "time": "22.12.2025 19:48:03 UTC+01:00"
  },
  {
    "text": "Мені достатньо того що моя перша робота була у трійці, далі не цікаво- тільки фан!З часом всім стало зрозуміло що адекватного оцінювання не може бути, треки які дійсно класно звучать не проходять навіть у фінал, про що я казав після першого конкурсу.",
    "date": "2025-12-22",
    "time": "22.12.2025 19:54:22 UTC+01:00"
  },
  {
    "text": "Так але доведеться витратити 60 вхідних каналів для 30 стерео гітар…",
    "date": "2025-12-22",
    "time": "22.12.2025 19:55:45 UTC+01:00"
  },
  {
    "text": "Це вже не перевірити - може якись розумник з аналізами айкю вдався до чітерства та перепостив голосувальню у інший чат 😂",
    "date": "2025-12-22",
    "time": "22.12.2025 19:57:43 UTC+01:00"
  },
  {
    "text": "Мені теж нравиться як воно горить )",
    "date": "2025-12-22",
    "time": "22.12.2025 19:58:52 UTC+01:00"
  },
  {
    "text": "У вас скільки вхідних каналів до вінга не рахуючи тих які на борту?",
    "date": "2025-12-22",
    "time": "22.12.2025 19:59:58 UTC+01:00"
  },
  {
    "text": "Взагалі, без тих що на борту дошки",
    "date": "2025-12-22",
    "time": "22.12.2025 20:01:15 UTC+01:00"
  },
  {
    "text": "Так, бачу що много написав, але якщо прибрати все зайве та вінг рек то виходе що - 48",
    "date": "2025-12-22",
    "time": "22.12.2025 20:14:57 UTC+01:00"
  },
  {
    "text": "То що вінг рек це вже +1 пульт, хоч і використовується як і/о",
    "date": "2025-12-22",
    "time": "22.12.2025 20:18:24 UTC+01:00"
  },
  {
    "text": "Мене не бентежить, просто цікаво скільки фізичних входів у пересічної церкви регіонального рівня 😁",
    "date": "2025-12-22",
    "time": "22.12.2025 20:28:08 UTC+01:00"
  },
  {
    "text": "У кого більше?",
    "date": "2025-12-22",
    "time": "22.12.2025 20:30:57 UTC+01:00"
  },
  {
    "text": "Живи як хочеш ніхто тебе не осудить 😁",
    "date": "2025-12-22",
    "time": "22.12.2025 20:37:17 UTC+01:00"
  },
  {
    "text": "А скільки каналів вам взагалі потрібно/використовуєте?",
    "date": "2025-12-22",
    "time": "22.12.2025 20:49:46 UTC+01:00"
  },
  {
    "text": "Міняй! Хто ж тобі заважає )",
    "date": "2025-12-22",
    "time": "22.12.2025 20:54:29 UTC+01:00"
  },
  {
    "text": "Твої дивовижні коаксіали та айкю повʼязані напряму з  наявністю вінг?!",
    "date": "2025-12-22",
    "time": "22.12.2025 20:58:24 UTC+01:00"
  },
  {
    "text": "Ти про ту штуку як у sound devices?",
    "date": "2025-12-22",
    "time": "22.12.2025 21:48:33 UTC+01:00"
  },
  {
    "text": "https://www.sounddevices.com/astral/Вже декілька років вони працюють, тому сінхи та щури напряглись",
    "date": "2025-12-22",
    "time": "22.12.2025 21:51:37 UTC+01:00"
  },
  {
    "text": "Лайв послухати -це ти у аудіо повідомлення будеш наспівувати?! 😁",
    "date": "2025-12-22",
    "time": "22.12.2025 23:19:51 UTC+01:00"
  },
  {
    "text": "Так, \"ефект плацебо\" ))) особливо коли береш оригінальний WAV 192 kHz, де порівнюється прямий сигнал і перезапис через X32,конвертуєш їх у FLAC,заливаєш у телеграмі вже там робиш \"сурйозне\" порівняння 😂Очевидно ж, що після цього різниця зобов’язана зникнути, бо FLAC + телеграм тепер новий еталон ...",
    "date": "2025-12-23",
    "time": "23.12.2025 10:06:29 UTC+01:00"
  },
  {
    "text": "Все так і залишилось!Крім лінійних масивів є  ще інші потужні системи ))",
    "date": "2025-12-23",
    "time": "23.12.2025 10:09:58 UTC+01:00"
  },
  {
    "text": "Я точно не маю їх на увазі, бо це компромісне рішення для великих майданчиків. Потужна чи велика система це не обовʼязково лінійний масив як на мій розсуд та досвід.",
    "date": "2025-12-23",
    "time": "23.12.2025 10:15:43 UTC+01:00"
  },
  {
    "text": "Якість поєднання між елементами у \"вертикальній\" площині та помилкове застосування )",
    "date": "2025-12-23",
    "time": "23.12.2025 10:21:53 UTC+01:00"
  },
  {
    "text": "Це що - чернівецький клуб наукової фантастики відкрив ремоут сесію тут у чаті?!Адміністрація@KostyantinZvuk‼️🤣",
    "date": "2025-12-23",
    "time": "23.12.2025 10:33:01 UTC+01:00"
  },
  {
    "text": "Ох, да… хто б ще мені розповів про казочки 😭",
    "date": "2025-12-23",
    "time": "23.12.2025 10:35:30 UTC+01:00"
  },
  {
    "text": "А ну,  наприклад яка сама?",
    "date": "2025-12-23",
    "time": "23.12.2025 10:37:33 UTC+01:00"
  },
  {
    "text": "FLAC реально може звучати гірше- це не фантастика, а технічна реальність. Усе залежить від конкретного плеєра, реалізації декодера та тракту, на якому це відтворюється.На системах із достатньою роздільною здатністю різницю чути, а от з твоїм “професійним” досвідом -так, там справді різниці немає....",
    "date": "2025-12-23",
    "time": "23.12.2025 10:49:35 UTC+01:00"
  },
  {
    "text": "Ну то підійди до дзеркала й розкажи це спочатку собі- про почуття гумору.Це не порада, дякувати не треба.",
    "date": "2025-12-23",
    "time": "23.12.2025 10:58:45 UTC+01:00"
  },
  {
    "text": "Так, це на мій новий айфон, 3 роки тому його зробив! Подобається?",
    "date": "2025-12-23",
    "time": "23.12.2025 11:05:56 UTC+01:00"
  },
  {
    "text": "Насправді доволі дотепно, не вважаєш?Ах так… я ж забув -із самоіронією в тебе стабільні труднощі. Я ж уже звертав на це увагу раніше 😁",
    "date": "2025-12-23",
    "time": "23.12.2025 11:06:37 UTC+01:00"
  },
  {
    "text": "Мені подобається!",
    "date": "2025-12-23",
    "time": "23.12.2025 11:07:58 UTC+01:00"
  },
  {
    "text": "А мені здається що це може бути лише від потужного почуття гумору Олександра! Просто не витримав, слабак 🥹",
    "date": "2025-12-23",
    "time": "23.12.2025 11:14:15 UTC+01:00"
  },
  {
    "text": "Як я вже казав і це було ще у першій дискусії - різниця скоріше за все може бути у плеєрі та кодеку- різні DSP обробки для wav та flac, різний dither, різний SRC, різна гучність (є ті хто відчуває різницю від 0.1 дБ).І добра якісна система з роздільною якістю та великою динамікою все це покаже.",
    "date": "2025-12-23",
    "time": "23.12.2025 11:31:47 UTC+01:00"
  },
  {
    "text": "Мова йшла за wav та flac…",
    "date": "2025-12-23",
    "time": "23.12.2025 11:39:47 UTC+01:00"
  },
  {
    "text": "То він що тоді більш віруючий за Олександра?!",
    "date": "2025-12-23",
    "time": "23.12.2025 11:41:51 UTC+01:00"
  },
  {
    "text": "Початок цієї дискусії до якої Вова завжди повертається саме у тому що я колись сказав що у навіть порівняні wav та flac - останній звучить по низу прям зовсім не але…З цього всьо почалося, але тоді ти ще не у цьому чаті тому не можеш це памʼятати.А що до мого останнього флак  - то вже саме відтво...",
    "date": "2025-12-23",
    "time": "23.12.2025 11:48:53 UTC+01:00"
  },
  {
    "text": "Що ти там доводиш, давай ще раз ↪️",
    "date": "2025-12-23",
    "time": "23.12.2025 11:50:03 UTC+01:00"
  },
  {
    "text": "Якщо ти знаєш про початок, то до чого це - \"Ну погодь: ти ж Вові сам закинув, що він зіпсус тест тим, що ВСЕ к флак конвертнув. То до чого тут між вав і флак?\"",
    "date": "2025-12-23",
    "time": "23.12.2025 11:51:51 UTC+01:00"
  },
  {
    "text": "Не задовольняє мене відтворення у телеграм!",
    "date": "2025-12-23",
    "time": "23.12.2025 11:53:12 UTC+01:00"
  },
  {
    "text": "Так особливо у порівнянні з wav 192kHz",
    "date": "2025-12-23",
    "time": "23.12.2025 11:54:59 UTC+01:00"
  },
  {
    "text": "Так, згоден! Треба було відтворювати та записувати у 768 kHz для максимально можливої якості порівняння та наближення до реальних умов!",
    "date": "2025-12-23",
    "time": "23.12.2025 12:02:00 UTC+01:00"
  },
  {
    "text": "Так, абсолютно. Тоді, може, почнеш із себе та наведеш конкретний приклад і застосуєш власну пораду на практиці?Бо всім і так зрозуміло, якого класу продукція бехрінджер. Саме про якість аудіо й ішла мова, а не про те, хто і як уміє крутити мікси на X32.Але, схоже, не всім вдається вгамувати свій ...",
    "date": "2025-12-23",
    "time": "23.12.2025 12:26:31 UTC+01:00"
  },
  {
    "text": "Щось в тебе сьогодні не задалось - який гугл драйв?Я скинув файловий архів у чат 😁",
    "date": "2025-12-23",
    "time": "23.12.2025 18:54:19 UTC+01:00"
  },
  {
    "text": "Я спеціально скинув файловий архів щоб кожен мав можливість відкрити у себе і послухати у максимальній роздільній здатності і без конвертації відтворювача телеграма. Вова зробив конвертацію з wav 192 у flac 48, бо телеграм нейтів у 48 (якщо я не помиляюсь).",
    "date": "2025-12-23",
    "time": "23.12.2025 19:54:23 UTC+01:00"
  },
  {
    "text": "Тобі теж гарного дня! Брате! 😁",
    "date": "2025-12-23",
    "time": "23.12.2025 21:34:24 UTC+01:00"
  },
  {
    "text": "Ну нащо ти так, таке може образити Олександра.Знов хочеш слухати про неповагу?!",
    "date": "2025-12-23",
    "time": "23.12.2025 21:39:56 UTC+01:00"
  },
  {
    "text": "Та Олександр нормальний та адекватний християнин, це я збочене чудовисько срач фану чатів! 🤷‍♂️",
    "date": "2025-12-23",
    "time": "23.12.2025 22:02:18 UTC+01:00"
  },
  {
    "text": "Та дай хоч передохнути читачам 😭",
    "date": "2025-12-23",
    "time": "23.12.2025 22:07:03 UTC+01:00"
  },
  {
    "text": "Це що, ревнощі -бо увага пройшла повз тебе? 🤣",
    "date": "2025-12-23",
    "time": "23.12.2025 22:18:21 UTC+01:00"
  },
  {
    "text": "Я ж не знаю яке було запитання? Хоча заради фану і не треба знати ))",
    "date": "2025-12-23",
    "time": "23.12.2025 22:20:13 UTC+01:00"
  },
  {
    "text": "Я б обрав - звичка до токсичної комунікації, це 💯",
    "date": "2025-12-23",
    "time": "23.12.2025 22:21:52 UTC+01:00"
  },
  {
    "text": "Не дає зробити більше 3х матриц?",
    "date": "2025-12-23",
    "time": "23.12.2025 22:40:45 UTC+01:00"
  },
  {
    "text": "Вони десь пів року як чи більше пофіксили ту журбу з матрицями…",
    "date": "2025-12-23",
    "time": "23.12.2025 22:42:12 UTC+01:00"
  },
  {
    "text": "Раніше вони взагалі не працювали )))",
    "date": "2025-12-23",
    "time": "23.12.2025 22:43:41 UTC+01:00"
  },
  {
    "text": "То 6 моно або 3 стерео, чи як? Бо раніше було загалом лише 3, моно або стерео..",
    "date": "2025-12-23",
    "time": "23.12.2025 22:45:21 UTC+01:00"
  },
  {
    "text": "То виходить можна зробити 2 стерео та 2 моно - загалом 6?!",
    "date": "2025-12-23",
    "time": "23.12.2025 22:46:42 UTC+01:00"
  },
  {
    "text": "Я ж памʼятаю вони щось викатували з фіксом тих матриц бідосних",
    "date": "2025-12-23",
    "time": "23.12.2025 22:48:23 UTC+01:00"
  },
  {
    "text": "Виходить що треба сумніватись у кваліфікації Романа Сімона )))",
    "date": "2025-12-23",
    "time": "23.12.2025 22:51:00 UTC+01:00"
  },
  {
    "text": "Я б точно не довіряв комусь з таким імʼям 🤣",
    "date": "2025-12-23",
    "time": "23.12.2025 22:51:54 UTC+01:00"
  },
  {
    "text": "Забороняєш?! 😂",
    "date": "2025-12-23",
    "time": "23.12.2025 22:53:27 UTC+01:00"
  },
  {
    "text": "Треба! Костя заборонив!",
    "date": "2025-12-23",
    "time": "23.12.2025 23:21:07 UTC+01:00"
  },
  {
    "text": "Та то ж не тім бехрінджер, то тім - не кажіть нічого поганого про звук х32/вінга бо в мене х32/вінг, але я такий класний насводила тому в мене якість звуку не така погана з х32/вінг 😭🤣",
    "date": "2025-12-23",
    "time": "23.12.2025 23:25:01 UTC+01:00"
  },
  {
    "text": "Так буде трохи краще",
    "date": "2025-12-23",
    "time": "23.12.2025 23:27:30 UTC+01:00"
  },
  {
    "text": "Дякую за анотацію, Кеп!",
    "date": "2025-12-23",
    "time": "23.12.2025 23:30:54 UTC+01:00"
  },
  {
    "text": "По роздрібній ціні на $1К мінімум дорожче вінга…",
    "date": "2025-12-23",
    "time": "23.12.2025 23:35:06 UTC+01:00"
  },
  {
    "text": "Але так , все одно він  ще у бюджетному сегменті",
    "date": "2025-12-23",
    "time": "23.12.2025 23:36:12 UTC+01:00"
  },
  {
    "text": "Но на длайве этого нельзя сделать на индивидуальные каналы, если не ошибаюсь?",
    "date": "2025-12-23",
    "time": "23.12.2025 23:38:00 UTC+01:00"
  },
  {
    "text": "Х32 задер планку у питанні роутінга, це мабуть щось нове у індустрії назначати вхідні канали тільки фіксованими групами по 8 😂",
    "date": "2025-12-23",
    "time": "23.12.2025 23:38:41 UTC+01:00"
  },
  {
    "text": "И выбор из какой части тракта брать звук)",
    "date": "2025-12-23",
    "time": "23.12.2025 23:39:54 UTC+01:00"
  },
  {
    "text": "Там суть було що з виходом Х32….",
    "date": "2025-12-23",
    "time": "23.12.2025 23:40:35 UTC+01:00"
  },
  {
    "text": "@step_team_uaсаме час написати - ділайв 💩",
    "date": "2025-12-23",
    "time": "23.12.2025 23:42:03 UTC+01:00"
  },
  {
    "text": "Я прямо почув як він каже!",
    "date": "2025-12-24",
    "time": "24.12.2025 00:07:46 UTC+01:00"
  },
  {
    "text": "Цікава думка спільноти чату, чи можна вже відкривати такий жанр - copy/paste worship music?",
    "date": "2025-12-24",
    "time": "24.12.2025 01:26:26 UTC+01:00"
  },
  {
    "text": "Та почекай ж ти, зараз ми все дізнаємось як було на справді!",
    "date": "2025-12-24",
    "time": "24.12.2025 01:53:24 UTC+01:00"
  },
  {
    "text": "Взагалі то так, треба ) основний/фундаментал тон барабану саме від резонатору.Навіть якщо по нему не бʼють то він всеодно рухається с такою самою силою і часом як і верхній, то ж за рік-два його властивості уходять.",
    "date": "2025-12-24",
    "time": "24.12.2025 20:17:46 UTC+01:00"
  },
  {
    "text": "Залиш Озон5 науковим фантастам",
    "date": "2025-12-24",
    "time": "24.12.2025 20:36:17 UTC+01:00"
  },
  {
    "text": "Ну хоч до цього допетрили якось.Може з часом дійде розуміння , що я казав саме за схожу поведінку зі струнами коли налаштувати складно із за старих та зношених струн 😁",
    "date": "2025-12-24",
    "time": "24.12.2025 20:57:27 UTC+01:00"
  },
  {
    "text": "Може там вже залежність від Озону5 ))",
    "date": "2025-12-24",
    "time": "24.12.2025 20:59:03 UTC+01:00"
  },
  {
    "text": "Ну то налаштовуй, хто тобі забороняє?!",
    "date": "2025-12-24",
    "time": "24.12.2025 21:00:13 UTC+01:00"
  },
  {
    "text": "Чи тобі просто не подобається що ми це обговорюємо?!",
    "date": "2025-12-24",
    "time": "24.12.2025 21:00:34 UTC+01:00"
  },
  {
    "text": "Ми ж обговорюємо систему де присутні обидва пластика - ударний та резонаторний!У такій системі резонаторний пластик сильніше керує основним тоном барабану - менше демпфован, коливається довше, краще фіксує стабільну частоту і краще підсилює- тому домінує над ударним. Хоча всеодно фізично основний...",
    "date": "2025-12-24",
    "time": "24.12.2025 21:25:09 UTC+01:00"
  },
  {
    "text": "А можна докази де верхній пластик більше впливає на сустейн?",
    "date": "2025-12-24",
    "time": "24.12.2025 21:49:17 UTC+01:00"
  },
  {
    "text": "А ну давай про це докладніше що саме ти маєш на увазі?",
    "date": "2025-12-24",
    "time": "24.12.2025 21:52:32 UTC+01:00"
  },
  {
    "text": "Ми говорили саме за резонаторні пластики, є різна взаємодія коли резонаторний пластик присутній чи ні.",
    "date": "2025-12-24",
    "time": "24.12.2025 22:00:03 UTC+01:00"
  },
  {
    "text": "Ну давай студент, поділись   знаннями як насправді барабан працює!Про аллен хіт ми вже чули, тепер про барабани послухаємо 😁",
    "date": "2025-12-24",
    "time": "24.12.2025 22:02:50 UTC+01:00"
  },
  {
    "text": "Так, є безліч способів налаштування, і саме той який ти приводиш до уваги, щоб мене підловити та виправдати свої ідеї - не є розповсюдженим і є виключення, бо у такому випадку він практично не резонує та не впливає на тон барабану!",
    "date": "2025-12-24",
    "time": "24.12.2025 22:09:14 UTC+01:00"
  },
  {
    "text": "У більшості класичних і популярних налаштувань з двома пластиками нота резонаторного пластику домінує у інтервалі. О то цікаво як, так виходе…Так є декілька інтервалів де нота ударного може домінувати але такі налаштування доволі експериментальні де інтервал звучить у дисонансі.",
    "date": "2025-12-24",
    "time": "24.12.2025 22:18:26 UTC+01:00"
  },
  {
    "text": "То треба навести більш докладний приклад - ноти на які налаштовані різні пластики, рівень демпінгу та саме параметри барабану з пластикамиБо в даному випадку, все спеціально підлаштовано так щоб ти міг маніпулювати - і щоб я не відповів то можна обіграти як хочеш!",
    "date": "2025-12-24",
    "time": "24.12.2025 22:21:27 UTC+01:00"
  },
  {
    "text": "У цій взаємодії практично завжди буде домінувати звучання та нота резонаторного пластику, він не демфований ударом тому швидше та потужніше формує тон. Ударний пластик формує тон трохи пізніше тому резонанс від ударного слабкіший якщо порівнювати з резонаторним.Це дуже легко перевірити у ютубі ба...",
    "date": "2025-12-24",
    "time": "24.12.2025 22:52:32 UTC+01:00"
  },
  {
    "text": "Якщо ти маєш на увазі отвір у корпусі барабану для виходу повітря, то отвір майже не впливає на перший короткий етап (початковий імпульс і передачу тиску між мембранами)Для такого обʼєму газу/повітря у барабані отвір трохи більший але приблизно схожий до діаметру 1/4 джек розʼєму. Тому можна розг...",
    "date": "2025-12-24",
    "time": "24.12.2025 23:26:26 UTC+01:00"
  },
  {
    "text": "Тому твоє розуміння саме цього моменту є хибним і це науково підтверджується.І хто тут фантаст після такого?!",
    "date": "2025-12-24",
    "time": "24.12.2025 23:34:51 UTC+01:00"
  },
  {
    "text": "Ти щось перекрутив та сам не зрозумів що як відбувається )",
    "date": "2025-12-24",
    "time": "24.12.2025 23:46:47 UTC+01:00"
  },
  {
    "text": "Народ, мені підготовлювати мультітрек? Конкурс робимо?",
    "date": "2025-01-31",
    "time": "31.01.2025 18:51:12 UTC+01:00"
  },
  {
    "text": "@didgugan1зараз грає на гітарі, він не відповість)",
    "date": "2025-01-31",
    "time": "31.01.2025 18:58:34 UTC+01:00"
  },
  {
    "text": "Завтра підготую мультітрек, можна з неділі чи понеділка почати",
    "date": "2025-01-31",
    "time": "31.01.2025 20:41:36 UTC+01:00"
  },
  {
    "text": "Буде 2-3 мин.",
    "date": "2025-01-31",
    "time": "31.01.2025 21:35:03 UTC+01:00"
  },
  {
    "text": "Точно скажу завтра, коли послухаю та виберу частину нормальну з розвитком",
    "date": "2025-01-31",
    "time": "31.01.2025 21:37:16 UTC+01:00"
  },
  {
    "text": "Скоріш за все так і буде",
    "date": "2025-01-31",
    "time": "31.01.2025 21:38:47 UTC+01:00"
  },
  {
    "text": "Але не точно))",
    "date": "2025-01-31",
    "time": "31.01.2025 21:39:17 UTC+01:00"
  },
  {
    "text": "Ти бачив скільки триває повна пісня?)))",
    "date": "2025-01-31",
    "time": "31.01.2025 21:40:32 UTC+01:00"
  },
  {
    "text": "Но 34хв. Якось багато))",
    "date": "2025-01-31",
    "time": "31.01.2025 21:41:55 UTC+01:00"
  },
  {
    "text": "Доречі готуйтеся, мультітрек буде не малий), не 7 треків)",
    "date": "2025-01-31",
    "time": "31.01.2025 21:46:47 UTC+01:00"
  },
  {
    "text": "https://youtu.be/NYbtzWdxxuo?si=MgQRp9KltBld2tK3",
    "date": "2025-03-05",
    "time": "05.03.2025 00:03:53 UTC+01:00"
  },
  {
    "text": "Так, такий самий як і метод вимірювань! 🤣🤣🤣",
    "date": "2025-03-05",
    "time": "05.03.2025 00:54:29 UTC+01:00"
  },
  {
    "text": "Залиш свій хайп! То ти такий розумний коли треба підігнати одне до іншого, а коли нема порівняння один до одного, що зазвичай у реальному житті і відбувається - то цікаво подивитись як ти зробиш з простих преампів щось на кшталт преміум!",
    "date": "2025-03-05",
    "time": "05.03.2025 18:46:59 UTC+01:00"
  },
  {
    "text": "Лівий взагалі чел, чимось нагадує Вову, Арестовича, та інших фокусників - показує на одне і каже дивиться щоб відвернути увагу від іншого! 😁",
    "date": "2025-03-05",
    "time": "05.03.2025 18:55:45 UTC+01:00"
  },
  {
    "text": "Не почують бо ніхто не дивиться ту трансляцію! 😆",
    "date": "2025-03-05",
    "time": "05.03.2025 19:02:25 UTC+01:00"
  },
  {
    "text": "Мій мікс досі всі памʼятають - бо це легенда! А твій, чи Вови?!",
    "date": "2025-03-05",
    "time": "05.03.2025 19:05:08 UTC+01:00"
  },
  {
    "text": "Я можу і без перемоги над Вовою домінувати!",
    "date": "2025-03-05",
    "time": "05.03.2025 19:06:11 UTC+01:00"
  },
  {
    "text": "Трамп стайл!",
    "date": "2025-03-05",
    "time": "05.03.2025 19:07:37 UTC+01:00"
  },
  {
    "text": "Це у вас в хілсе таке зараз, чи то з минулого залишилось?!",
    "date": "2025-03-05",
    "time": "05.03.2025 19:10:02 UTC+01:00"
  },
  {
    "text": "То запрошуй@Kostyantin25😁",
    "date": "2025-03-05",
    "time": "05.03.2025 19:14:16 UTC+01:00"
  },
  {
    "text": "То я просто тикав у всі мікси і не слухав, попав у твій! Тобі повезло що я проголосував, хоча це вплинуло на результат?!",
